refracture, refractured, refractured, refracturing
refrain, refrained, refrained, refraining
refresh, refreshed, refreshed, refreshing
refreshen, refreshened, refreshened, refreshening
refrigerate, refrigerated, refrigerated, refrigerating
refuel, refueled, refueled, refueling
refund, refunded, refunded, refunding
refurbish, refurbished, refurbished, refurbishing
refurnish, refurnished, refurnished, refurnishing
refuse, refused, refused, refusing
refute, refuted, refuted, refuting
regain, regained, regained, regaining
regale, regaled, regaled, regaling
regard, regarded, regarded, regarding
regenerate, regenerated, regenerated, regenerating
regift, regifted, regifted, regifting
regiment, regimented, regimented, regimenting
register, registered, registered, registering
regorge, regorged, regorged, regorging
regress, regressed, regressed, regressing
regret, regreted, regreted, regreting
regroup, regrouped, regrouped, regrouping
regrow, regrowed, regrowed, regrowing
regularise, regularised, regularised, regularising
regularize, regularized, regularized, regularizing
regulate, regulated, regulated, regulating
regurgitate, regurgitated, regurgitated, regurgitating
rehabilitate, rehabilitated, rehabilitated, rehabilitating
reharmonise, reharmonised, reharmonised, reharmonising
reharmonize, reharmonized, reharmonized, reharmonizing
rehash, rehashed, rehashed, rehashing
rehear, reheared, reheared, rehearing
rehearse, rehearsed, rehearsed, rehearsing
reheat, reheated, reheated, reheating
reheel, reheeled, reheeled, reheeling
rehouse, rehoused, rehoused, rehousing
reify, reified, reified, reifying
reign, reigned, reigned, reigning
reignite, reignited, reignited, reigniting
reimburse, reimbursed, reimbursed, reimbursing
reimpose, reimposed, reimposed, reimposing
rein, reined, reined, reining
reincarnate, reincarnated, reincarnated, reincarnating
reinforce, reinforced, reinforced, reinforcing
reinstall, reinstalled, reinstalled, reinstalling
reinstate, reinstated, reinstated, reinstating
reinsure, reinsured, reinsured, reinsuring
reintegrate, reintegrated, reintegrated, reintegrating
reinterpret, reinterpreted, reinterpreted, reinterpreting
reintroduce, reintroduced, reintroduced, reintroducing
reinvent, reinvented, reinvented, reinventing
reinvigorate, reinvigorated, reinvigorated, reinvigorating
reissue, reissued, reissued, reissuing
reiterate, reiterated, reiterated, reiterating
reject, rejected, rejected, rejecting
rejig, rejiged, rejiged, rejiging
rejoice, rejoiced, rejoiced, rejoicing
rejoin, rejoined, rejoined, rejoining
rejuvenate, rejuvenated, rejuvenated, rejuvenating
rekindle, rekindled, rekindled, rekindling
relace, relaced, relaced, relacing
relapse, relapsed, relapsed, relapsing
relate, related, related, relating
relativise, relativised, relativised, relativising
relativize, relativized, relativized, relativizing
relax, relaxed, relaxed, relaxing
relay, relaied, relaied, relaying
relearn, relearned, relearned, relearning
release, released, released, releasing
relegate, relegated, relegated, relegating
relent, relented, relented, relenting
relieve, relieved, relieved, relieving
reline, relined, relined, relining
relinquish, relinquished, relinquished, relinquishing
relish, relished, relished, relishing
relive, relived, relived, reliving
reload, reloaded, reloaded, reloading
relocate, relocated, relocated, relocating
rely, relied, relied, relying
relyric, relyriced, relyriced, relyricing
remain, remained, remained, remaining
remainder, remaindered, remaindered, remaindering
remake, remaked, remaked, remaking
remand, remanded, remanded, remanding
remark, remarked, remarked, remarking
remarry, remarried, remarried, remarrying
remediate, remediated, remediated, remediating
remedy, remedied, remedied, remedying
remember, remembered, remembered, remembering
remilitarise, remilitarised, remilitarised, remilitarising
remilitarize, remilitarized, remilitarized, remilitarizing
remind, reminded, reminded, reminding
reminisce, reminisced, reminisced, reminiscing
remit, remited, remited, remiting
remodel, remodeled, remodeled, remodeling
remold, remolded, remolded, remolding
remonstrate, remonstrated, remonstrated, remonstrating
remould, remoulded, remoulded, remoulding
remount, remounted, remounted, remounting
remove, removed, removed, removing
remunerate, remunerated, remunerated, remunerating
rename, renamed, renamed, renaming
rend, rended, rended, rending
render, rendered, rendered, rendering
render-set, render-seted, render-seted, render-seting
rendezvous, rendezvoused, rendezvoused, rendezvousing
renegade, renegaded, renegaded, renegading
renege, reneged, reneged, reneging
renegociate, renegociated, renegociated, renegociating
renegotiate, renegotiated, renegotiated, renegotiating
renew, renewed, renewed, renewing
renormalise, renormalised, renormalised, renormalising
renormalize, renormalized, renormalized, renormalizing
renounce, renounced, renounced, renouncing
renovate, renovated, renovated, renovating
rent, rented, rented, renting
reopen, reopened, reopened, reopening
reorder, reordered, reordered, reordering
reorganise, reorganised, reorganised, reorganising
reorganize, reorganized, reorganized, reorganizing
reorient, reoriented, reoriented, reorienting
reorientate, reorientated, reorientated, reorientating
repaint, repainted, repainted, repainting
repair, repaired, repaired, repairing
repatriate, repatriated, repatriated, repatriating
repay, repaied, repaied, repaying
repeal, repealed, repealed, repealing
repeat, repeated, repeated, repeating
repel, repeled, repeled, repeling
repent, repented, repented, repenting
repercuss, repercussed, repercussed, repercussing
rephrase, rephrased, rephrased, rephrasing
repine, repined, repined, repining
replace, replaced, replaced, replacing
replant, replanted, replanted, replanting
replay, replaied, replaied, replaying
replenish, replenished, replenished, replenishing
replete, repleted, repleted, repleting
replicate, replicated, replicated, replicating
reply, replied, replied, replying
repoint, repointed, repointed, repointing
report, reported, reported, reporting
repose, reposed, reposed, reposing
reposit, reposited, reposited, repositing
reposition, repositioned, repositioned, repositioning
repossess, repossessed, repossessed, repossessing
repot, repoted, repoted, repoting
reprehend, reprehended, reprehended, reprehending
represent, represented, represented, representing
repress, repressed, repressed, repressing
reprieve, reprieved, reprieved, reprieving
reprimand, reprimanded, reprimanded, reprimanding
reprint, reprinted, reprinted, reprinting
reprise, reprised, reprised, reprising
reprize, reprized, reprized, reprizing
reproach, reproached, reproached, reproaching
reprobate, reprobated, reprobated, reprobating
reprocess, reprocessed, reprocessed, reprocessing
reproduce, reproduced, reproduced, reproducing
reproof, reproofed, reproofed, reproofing
reprove, reproved, reproved, reproving
republish, republished, republished, republishing
repudiate, repudiated, repudiated, repudiating
repugn, repugned, repugned, repugning
repulse, repulsed, repulsed, repulsing
repurchase, repurchased, repurchased, repurchasing
repute, reputed, reputed, reputing
request, requested, requested, requesting
require, required, required, requiring
requisition, requisitioned, requisitioned, requisitioning
requite, requited, requited, requiting
reread, rereaded, rereaded, rereading
rerun, reruned, reruned, reruning
rescale, rescaled, rescaled, rescaling
reschedule, rescheduled, rescheduled, rescheduling
rescind, rescinded, rescinded, rescinding
rescue, rescued, rescued, rescuing
reseal, resealed, resealed, resealing
research, researched, researched, researching
reseat, reseated, reseated, reseating
resect, resected, resected, resecting
reseed, reseeded, reseeded, reseeding
resell, reselled, reselled, reselling
resemble, resembled, resembled, resembling
resent, resented, resented, resenting
reserve, reserved, reserved, reserving
reset, reseted, reseted, reseting
resettle, resettled, resettled, resettling
resew, resewed, resewed, resewing
reshape, reshaped, reshaped, reshaping
reship, reshiped, reshiped, reshiping
reshoot, reshooted, reshooted, reshooting
reshuffle, reshuffled, reshuffled, reshuffling
reside, resided, resided, residing
resift, resifted, resifted, resifting
resign, resigned, resigned, resigning
resile, resiled, resiled, resiling
resinate, resinated, resinated, resinating
resist, resisted, resisted, resisting
resize, resized, resized, resizing
resmudge, resmudged, resmudged, resmudging
resole, resoled, resoled, resoling
resolve, resolved, resolved, resolving
resonate, resonated, resonated, resonating
resorb, resorbed, resorbed, resorbing
resort, resorted, resorted, resorting
resound, resounded, resounded, resounding
respect, respected, respected, respecting
respire, respired, respired, respiring
respite, respited, respited, respiting
resplend, resplended, resplended, resplending
respond, responded, responded, responding
rest, rested, rested, resting
restart, restarted, restarted, restarting
restate, restated, restated, restating
restitute, restituted, restituted, restituting
restock, restocked, restocked, restocking
restore, restored, restored, restoring
restrain, restrained, restrained, restraining
restrengthen, restrengthened, restrengthened, restrengthening
restrict, restricted, restricted, restricting
restructure, restructured, restructured, restructuring
resublime, resublimed, resublimed, resubliming
resubmit, resubmited, resubmited, resubmiting
result, resulted, resulted, resulting
resume, resumed, resumed, resuming
resurface, resurfaced, resurfaced, resurfacing
resurge, resurged, resurged, resurging
resurrect, resurrected, resurrected, resurrecting
resuscitate, resuscitated, resuscitated, resuscitating
resuspend, resuspended, resuspended, resuspending
ret, reted, reted, reting
retail, retailed, retailed, retailing
retain, retained, retained, retaining
retake, retaked, retaked, retaking
retaliate, retaliated, retaliated, retaliating
retard, retarded, retarded, retarding
retch, retched, retched, retching
retell, retelled, retelled, retelling
rethink, rethinked, rethinked, rethinking
retick, reticked, reticked, reticking
reticulate, reticulated, reticulated, reticulating
retie, retied, retied, retiing
retire, retired, retired, retiring
retool, retooled, retooled, retooling
retort, retorted, retorted, retorting
retouch, retouched, retouched, retouching
retrace, retraced, retraced, retracing
retract, retracted, retracted, retracting
retrain, retrained, retrained, retraining
retranslate, retranslated, retranslated, retranslating
retransmit, retransmited, retransmited, retransmiting
retread, retreaded, retreaded, retreading
retreat, retreated, retreated, retreating
retrench, retrenched, retrenched, retrenching
retrieve, retrieved, retrieved, retrieving
retrofit, retrofited, retrofited, retrofiting
retroflex, retroflexed, retroflexed, retroflexing
retrograde, retrograded, retrograded, retrograding
retrogress, retrogressed, retrogressed, retrogressing
retrospect, retrospected, retrospected, retrospecting
retrovert, retroverted, retroverted, retroverting
retry, retried, retried, retrying
return, returned, returned, returning
reunify, reunified, reunified, reunifying
reunite, reunited, reunited, reuniting
reuse, reused, reused, reusing
rev, reved, reved, reving
revalue, revalued, revalued, revaluing
revamp, revamped, revamped, revamping
reveal, revealed, revealed, revealing
revel, reveled, reveled, reveling
revenge, revenged, revenged, revenging
reverberate, reverberated, reverberated, reverberating
revere, revered, revered, revering
reverence, reverenced, reverenced, reverencing
reverse, reversed, reversed, reversing
revert, reverted, reverted, reverting
revet, reveted, reveted, reveting
review, reviewed, reviewed, reviewing
revile, reviled, reviled, reviling
revise, revised, revised, revising
revisit, revisited, revisited, revisiting
revitalise, revitalised, revitalised, revitalising
revitalize, revitalized, revitalized, revitalizing
revive, revived, revived, reviving
revivify, revivified, revivified, revivifying
revoke, revoked, revoked, revoking
revolt, revolted, revolted, revolting
revolutionise, revolutionised, revolutionised, revolutionising
revolutionize, revolutionized, revolutionized, revolutionizing
revolve, revolved, revolved, revolving
reward, rewarded, rewarded, rewarding
rewind, rewinded, rewinded, rewinding
rewire, rewired, rewired, rewiring
reword, reworded, reworded, rewording
rework, reworked, reworked, reworking
rewrite, rewrited, rewrited, rewriting
rhapsodise, rhapsodised, rhapsodised, rhapsodising
rhapsodize, rhapsodized, rhapsodized, rhapsodizing
rhumba, rhumbaed, rhumbaed, rhumbaing
rhyme, rhymed, rhymed, rhyming
rib, ribed, ribed, ribing
rice, riced, riced, ricing
rick, ricked, ricked, ricking
ricochet, ricocheted, ricocheted, ricocheting
rid, rided, rided, riding
riddle, riddled, riddled, riddling
ride, rided, rided, riding
ridge, ridged, ridged, ridging
ridicule, ridiculed, ridiculed, ridiculing
riff, riffed, riffed, riffing
riffle, riffled, riffled, riffling
rifle, rifled, rifled, rifling
rig, riged, riged, riging
right, righted, righted, righting
rigidify, rigidified, rigidified, rigidifying
rile, riled, riled, riling
rim, rimed, rimed, riming
rime, rimed, rimed, riming
ring, ringed, ringed, ringing
rinse, rinsed, rinsed, rinsing
riot, rioted, rioted, rioting
rip, riped, riped, riping
ripen, ripened, ripened, ripening
riposte, riposted, riposted, riposting
ripple, rippled, rippled, rippling
rise, rised, rised, rising
risk, risked, risked, risking
ritualise, ritualised, ritualised, ritualising
ritualize, ritualized, ritualized, ritualizing
rival, rivaled, rivaled, rivaling
rive, rived, rived, riving
rivet, riveted, riveted, riveting
roach, roached, roached, roaching
roam, roamed, roamed, roaming
roar, roared, roared, roaring
roast, roasted, roasted, roasting
rob, robed, robed, robing
robe, robed, robed, robing
rock, rocked, rocked, rocking
rocket, rocketed, rocketed, rocketing
roil, roiled, roiled, roiling
roister, roistered, roistered, roistering
roleplay, roleplaied, roleplaied, roleplaying
roll, rolled, rolled, rolling
rollerblade, rollerbladed, rollerbladed, rollerblading
rollick, rollicked, rollicked, rollicking
romance, romanced, romanced, romancing
romanise, romanised, romanised, romanising
romanize, romanized, romanized, romanizing
romanticise, romanticised, romanticised, romanticising
romanticize, romanticized, romanticized, romanticizing
romp, romped, romped, romping
roneo, roneoed, roneoed, roneoing
roof, roofed, roofed, roofing
rook, rooked, rooked, rooking
room, roomed, roomed, rooming
roost, roosted, roosted, roosting
root, rooted, rooted, rooting
rootle, rootled, rootled, rootling
rope, roped, roped, roping
rosin, rosined, rosined, rosining
rot, roted, roted, roting
rotate, rotated, rotated, rotating
rouge, rouged, rouged, rouging
rough, roughed, roughed, roughing
rough-dry, rough-dried, rough-dried, rough-drying
rough-hew, rough-hewed, rough-hewed, rough-hewing
rough-house, rough-housed, rough-housed, rough-housing
rough-sand, rough-sanded, rough-sanded, rough-sanding
roughcast, roughcasted, roughcasted, roughcasting
roughen, roughened, roughened, roughening
roughhouse, roughhoused, roughhoused, roughhousing
round, rounded, rounded, rounding
rouse, roused, roused, rousing
rout, routed, routed, routing
route, routed, routed, routing
rove, roved, roved, roving
row, rowed, rowed, rowing
rub, rubed, rubed, rubing
rubber, rubbered, rubbered, rubbering
rubberise, rubberised, rubberised, rubberising
rubberize, rubberized, rubberized, rubberizing
rubberneck, rubbernecked, rubbernecked, rubbernecking
rubberstamp, rubberstamped, rubberstamped, rubberstamping
rubbish, rubbished, rubbished, rubbishing
rubify, rubified, rubified, rubifying
rubric, rubriced, rubriced, rubricing
rubricate, rubricated, rubricated, rubricating
ruck, rucked, rucked, rucking
ruckle, ruckled, ruckled, ruckling
ruddle, ruddled, ruddled, ruddling
rue, rued, rued, ruing
ruff, ruffed, ruffed, ruffing
ruffle, ruffled, ruffled, ruffling
ruggedise, ruggedised, ruggedised, ruggedising
ruggedize, ruggedized, ruggedized, ruggedizing
ruin, ruined, ruined, ruining
rule, ruled, ruled, ruling
rumba, rumbaed, rumbaed, rumbaing
rumble, rumbled, rumbled, rumbling
ruminate, ruminated, ruminated, ruminating
rummage, rummaged, rummaged, rummaging
rumor, rumored, rumored, rumoring
rumour, rumoured, rumoured, rumouring
rumple, rumpled, rumpled, rumpling
rumpus, rumpused, rumpused, rumpusing
run, runed, runed, runing
rupture, ruptured, ruptured, rupturing
rush, rushed, rushed, rushing
rust, rusted, rusted, rusting
rusticate, rusticated, rusticated, rusticating
rustle, rustled, rustled, rustling
rut, ruted, ruted, ruting
saber, sabered, sabered, sabering
sabotage, sabotaged, sabotaged, sabotaging
sabre, sabred, sabred, sabring
saccharify, saccharified, saccharified, saccharifying
sack, sacked, sacked, sacking
sacrifice, sacrificed, sacrificed, sacrificing
sadden, saddened, saddened, saddening
saddle, saddled, saddled, saddling
safeguard, safeguarded, safeguarded, safeguarding
sag, saged, saged, saging
sail, sailed, sailed, sailing
sailplane, sailplaned, sailplaned, sailplaning
saint, sainted, sainted, sainting
salaam, salaamed, salaamed, salaaming
salinate, salinated, salinated, salinating
salivate, salivated, salivated, salivating
sallow, sallowed, sallowed, sallowing
salt, salted, salted, salting
saltate, saltated, saltated, saltating
salute, saluted, saluted, saluting
salvage, salvaged, salvaged, salvaging
salve, salved, salved, salving
samba, sambaed, sambaed, sambaing
sample, sampled, sampled, sampling
sanctify, sanctified, sanctified, sanctifying
sanction, sanctioned, sanctioned, sanctioning
sand, sanded, sanded, sanding
sandbag, sandbaged, sandbaged, sandbaging
sandblast, sandblasted, sandblasted, sandblasting
sandpaper, sandpapered, sandpapered, sandpapering
sandwich, sandwiched, sandwiched, sandwiching
sanitate, sanitated, sanitated, sanitating
sanitise, sanitised, sanitised, sanitising
sanitize, sanitized, sanitized, sanitizing
sap, saped, saped, saping
saponify, saponified, saponified, saponifying
sashay, sashaied, sashaied, sashaying
sass, sassed, sassed, sassing
sate, sated, sated, sating
satellite, satellited, satellited, satelliting
satiate, satiated, satiated, satiating
satirise, satirised, satirised, satirising
satirize, satirized, satirized, satirizing
satisfice, satisficed, satisficed, satisficing
satisfise, satisfised, satisfised, satisfising
satisfy, satisfied, satisfied, satisfying
saturate, saturated, saturated, saturating
sauce, sauced, sauced, saucing
saunter, sauntered, sauntered, sauntering
saute, sauted, sauted, sauting
savage, savaged, savaged, savaging
save, saved, saved, saving
savor, savored, savored, savoring
savour, savoured, savoured, savouring
savvy, savvied, savvied, savvying
saw, sawed, sawed, sawing
say, saied, saied, saying
scab, scabed, scabed, scabing
scaffold, scaffolded, scaffolded, scaffolding
scald, scalded, scalded, scalding
scale, scaled, scaled, scaling
scallop, scalloped, scalloped, scalloping
scalp, scalped, scalped, scalping
scam, scamed, scamed, scaming
scamp, scamped, scamped, scamping
scamper, scampered, scampered, scampering
scan, scaned, scaned, scaning
scandalise, scandalised, scandalised, scandalising
scandalize, scandalized, scandalized, scandalizing
scant, scanted, scanted, scanting
scar, scared, scared, scaring
scare, scared, scared, scaring
scarf, scarfed, scarfed, scarfing
scarify, scarified, scarified, scarifying
scarper, scarpered, scarpered, scarpering
scat, scated, scated, scating
scatter, scattered, scattered, scattering
scavenge, scavenged, scavenged, scavenging
scend, scended, scended, scending
scent, scented, scented, scenting
schedule, scheduled, scheduled, scheduling
schematise, schematised, schematised, schematising
schematize, schematized, schematized, schematizing
scheme, schemed, schemed, scheming
schlep, schleped, schleped, schleping
schmoose, schmoosed, schmoosed, schmoosing
schmooze, schmoozed, schmoozed, schmoozing
schnorr, schnorred, schnorred, schnorring
school, schooled, schooled, schooling
schuss, schussed, schussed, schussing
scintillate, scintillated, scintillated, scintillating
scissor, scissored, scissored, scissoring
sclaff, sclaffed, sclaffed, sclaffing
scoff, scoffed, scoffed, scoffing
scold, scolded, scolded, scolding
scollop, scolloped, scolloped, scolloping
scoop, scooped, scooped, scooping
scoot, scooted, scooted, scooting
scorch, scorched, scorched, scorching
score, scored, scored, scoring
scorn, scorned, scorned, scorning
scotch, scotched, scotched, scotching
scour, scoured, scoured, scouring
scourge, scourged, scourged, scourging
scout, scouted, scouted, scouting
scowl, scowled, scowled, scowling
scrabble, scrabbled, scrabbled, scrabbling
scrag, scraged, scraged, scraging
scram, scramed, scramed, scraming
scramble, scrambled, scrambled, scrambling
scranch, scranched, scranched, scranching
scrap, scraped, scraped, scraping
scrape, scraped, scraped, scraping
scratch, scratched, scratched, scratching
scraunch, scraunched, scraunched, scraunching
scrawl, scrawled, scrawled, scrawling
screak, screaked, screaked, screaking
scream, screamed, screamed, screaming
screech, screeched, screeched, screeching
screen, screened, screened, screening
screw, screwed, screwed, screwing
scribble, scribbled, scribbled, scribbling
scribe, scribed, scribed, scribing
scrimmage, scrimmaged, scrimmaged, scrimmaging
scrimp, scrimped, scrimped, scrimping
scrimshank, scrimshanked, scrimshanked, scrimshanking
script, scripted, scripted, scripting
scroll, scrolled, scrolled, scrolling
scrounge, scrounged, scrounged, scrounging
scrub, scrubed, scrubed, scrubing
scrunch, scrunched, scrunched, scrunching
scruple, scrupled, scrupled, scrupling
scrutinise, scrutinised, scrutinised, scrutinising
scrutinize, scrutinized, scrutinized, scrutinizing
scry, scried, scried, scrying
scud, scuded, scuded, scuding
scuff, scuffed, scuffed, scuffing
scuffle, scuffled, scuffled, scuffling
scull, sculled, sculled, sculling
sculpt, sculpted, sculpted, sculpting
sculpture, sculptured, sculptured, sculpturing
scum, scumed, scumed, scuming
scupper, scuppered, scuppered, scuppering
scurry, scurried, scurried, scurrying
scuttle, scuttled, scuttled, scuttling
scythe, scythed, scythed, scything
seal, sealed, sealed, sealing
seam, seamed, seamed, seaming
seaplane, seaplaned, seaplaned, seaplaning
sear, seared, seared, searing
search, searched, searched, searching
season, seasoned, seasoned, seasoning
seat, seated, seated, seating
secede, seceded, seceded, seceding
secern, secerned, secerned, secerning
secernate, secernated, secernated, secernating
seclude, secluded, secluded, secluding
second, seconded, seconded, seconding
second-guess, second-guessed, second-guessed, second-guessing
secrete, secreted, secreted, secreting
section, sectioned, sectioned, sectioning
sectionalise, sectionalised, sectionalised, sectionalising
sectionalize, sectionalized, sectionalized, sectionalizing
secularise, secularised, secularised, secularising
secularize, secularized, secularized, secularizing
secure, secured, secured, securing
sedate, sedated, sedated, sedating
sediment, sedimented, sedimented, sedimenting
seduce, seduced, seduced, seducing
see, seed, seed, seing
seed, seeded, seeded, seeding
seek, seeked, seeked, seeking
seel, seeled, seeled, seeling
seem, seemed, seemed, seeming
seep, seeped, seeped, seeping
seesaw, seesawed, seesawed, seesawing
seethe, seethed, seethed, seething
segment, segmented, segmented, segmenting
segregate, segregated, segregated, segregating
segue, segued, segued, seguing
seine, seined, seined, seining
seize, seized, seized, seizing
select, selected, selected, selecting
self-destroy, self-destroied, self-destroied, self-destroying
self-destruct, self-destructed, self-destructed, self-destructing
sell, selled, selled, selling
sellotape, sellotaped, sellotaped, sellotaping
semaphore, semaphored, semaphored, semaphoring
semi-automatise, semi-automatised, semi-automatised, semi-automatising
semi-automatize, semi-automatized, semi-automatized, semi-automatizing
send, sended, sended, sending
senesce, senesced, senesced, senescing
sense, sensed, sensed, sensing
sensibilise, sensibilised, sensibilised, sensibilising
sensibilize, sensibilized, sensibilized, sensibilizing
sensify, sensified, sensified, sensifying
sensitise, sensitised, sensitised, sensitising
sensitize, sensitized, sensitized, sensitizing
sensualise, sensualised, sensualised, sensualising
sensualize, sensualized, sensualized, sensualizing
sentence, sentenced, sentenced, sentencing
sentimentalise, sentimentalised, sentimentalised, sentimentalising
sentimentalize, sentimentalized, sentimentalized, sentimentalizing
sentimentise, sentimentised, sentimentised, sentimentising
sentimentize, sentimentized, sentimentized, sentimentizing
separate, separated, separated, separating
sequence, sequenced, sequenced, sequencing
sequester, sequestered, sequestered, sequestering
sequestrate, sequestrated, sequestrated, sequestrating
serenade, serenaded, serenaded, serenading
serialise, serialised, serialised, serialising
serialize, serialized, serialized, serializing
sermonise, sermonised, sermonised, sermonising
sermonize, sermonized, sermonized, sermonizing
serrate, serrated, serrated, serrating
serve, served, served, serving
service, serviced, serviced, servicing
set, seted, seted, seting
settle, settled, settled, settling
sever, severed, severed, severing
severalise, severalised, severalised, severalising
severalize, severalized, severalized, severalizing
sew, sewed, sewed, sewing
sex, sexed, sexed, sexing
sexualise, sexualised, sexualised, sexualising
sexualize, sexualized, sexualized, sexualizing
shack, shacked, shacked, shacking
shackle, shackled, shackled, shackling
