aah, aahed, aahed, aahing
abacinate, abacinated, abacinated, abacinating
abandon, abandoned, abandoned, abandoning
abase, abased, abased, abasing
abash, abashed, abashed, abashing
abate, abated, abated, abating
abbreviate, abbreviated, abbreviated, abbreviating
abdicate, abdicated, abdicated, abdicating
abduce, abduced, abduced, abducing
abduct, abducted, abducted, abducting
aberrate, aberrated, aberrated, aberrating
abet, abeted, abeted, abeting
abhor, abhored, abhored, abhoring
abide, abided, abided, abiding
abjure, abjured, abjured, abjuring
ablactate, ablactated, ablactated, ablactating
ablate, ablated, ablated, ablating
abnegate, abnegated, abnegated, abnegating
abolish, abolished, abolished, abolishing
abominate, abominated, abominated, abominating
abort, aborted, aborted, aborting
abound, abounded, abounded, abounding
about-face, about-faced, about-faced, about-facing
abrade, abraded, abraded, abrading
abrase, abrased, abrased, abrasing
abreact, abreacted, abreacted, abreacting
abridge, abridged, abridged, abridging
abrogate, abrogated, abrogated, abrogating
abscise, abscised, abscised, abscising
abscond, absconded, absconded, absconding
abseil, abseiled, abseiled, abseiling
absent, absented, absented, absenting
absolve, absolved, absolved, absolving
absorb, absorbed, absorbed, absorbing
absquatulate, absquatulated, absquatulated, absquatulating
abstain, abstained, abstained, abstaining
abstract, abstracted, abstracted, abstracting
abuse, abused, abused, abusing
abut, abuted, abuted, abuting
aby, abied, abied, abying
abye, abyed, abyed, abying
accede, acceded, acceded, acceding
accelerate, accelerated, accelerated, accelerating
accent, accented, accented, accenting
accentuate, accentuated, accentuated, accentuating
accept, accepted, accepted, accepting
access, accessed, accessed, accessing
accession, accessioned, accessioned, accessioning
acclaim, acclaimed, acclaimed, acclaiming
acclimate, acclimated, acclimated, acclimating
acclimatise, acclimatised, acclimatised, acclimatising
acclimatize, acclimatized, acclimatized, acclimatizing
accommodate, accommodated, accommodated, accommodating
accompany, accompanied, accompanied, accompanying
accomplish, accomplished, accomplished, accomplishing
accord, accorded, accorded, according
accost, accosted, accosted, accosting
account, accounted, accounted, accounting
accouter, accoutered, accoutered, accoutering
accoutre, accoutred, accoutred, accoutring
accredit, accredited, accredited, accrediting
accrete, accreted, accreted, accreting
accrue, accrued, accrued, accruing
acculturate, acculturated, acculturated, acculturating
accumulate, accumulated, accumulated, accumulating
accurse, accursed, accursed, accursing
accuse, accused, accused, accusing
accustom, accustomed, accustomed, accustoming
ace, aced, aced, acing
acerbate, acerbated, acerbated, acerbating
acetify, acetified, acetified, acetifying
acetylate, acetylated, acetylated, acetylating
acetylise, acetylised, acetylised, acetylising
acetylize, acetylized, acetylized, acetylizing
ache, ached, ached, aching
achieve, achieved, achieved, achieving
achromatise, achromatised, achromatised, achromatising
achromatize, achromatized, achromatized, achromatizing
acid-wash, acid-washed, acid-washed, acid-washing
acidify, acidified, acidified, acidifying
acidulate, acidulated, acidulated, acidulating
acknowledge, acknowledged, acknowledged, acknowledging
acquaint, acquainted, acquainted, acquainting
acquiesce, acquiesced, acquiesced, acquiescing
acquire, acquired, acquired, acquiring
acquit, acquited, acquited, acquiting
act, acted, acted, acting
action, actioned, actioned, actioning
activate, activated, activated, activating
actualise, actualised, actualised, actualising
actualize, actualized, actualized, actualizing
actuate, actuated, actuated, actuating
acuminate, acuminated, acuminated, acuminating
ad-lib, ad-libed, ad-libed, ad-libing
adapt, adapted, adapted, adapting
add, added, added, adding
addict, addicted, addicted, addicting
addle, addled, addled, addling
address, addressed, addressed, addressing
adduce, adduced, adduced, adducing
adduct, adducted, adducted, adducting
adhere, adhered, adhered, adhering
adjoin, adjoined, adjoined, adjoining
adjourn, adjourned, adjourned, adjourning
adjudge, adjudged, adjudged, adjudging
adjudicate, adjudicated, adjudicated, adjudicating
adjure, adjured, adjured, adjuring
adjust, adjusted, adjusted, adjusting
admeasure, admeasured, admeasured, admeasuring
administer, administered, administered, administering
administrate, administrated, administrated, administrating
admire, admired, admired, admiring
admit, admited, admited, admiting
admix, admixed, admixed, admixing
admonish, admonished, admonished, admonishing
adolesce, adolesced, adolesced, adolescing
adopt, adopted, adopted, adopting
adore, adored, adored, adoring
adorn, adorned, adorned, adorning
adsorb, adsorbed, adsorbed, adsorbing
adulate, adulated, adulated, adulating
adulterate, adulterated, adulterated, adulterating
adumbrate, adumbrated, adumbrated, adumbrating
advance, advanced, advanced, advancing
advantage, advantaged, advantaged, advantaging
advect, advected, advected, advecting
adventure, adventured, adventured, adventuring
advert, adverted, adverted, adverting
advertise, advertised, advertised, advertising
advertize, advertized, advertized, advertizing
advise, advised, advised, advising
advocate, advocated, advocated, advocating
aerate, aerated, aerated, aerating
aerify, aerified, aerified, aerifying
aerosolise, aerosolised, aerosolised, aerosolising
aerosolize, aerosolized, aerosolized, aerosolizing
aestivate, aestivated, aestivated, aestivating
affect, affected, affected, affecting
affiance, affianced, affianced, affiancing
affiliate, affiliated, affiliated, affiliating
affirm, affirmed, affirmed, affirming
affix, affixed, affixed, affixing
afflict, afflicted, afflicted, afflicting
afford, afforded, afforded, affording
afforest, afforested, afforested, afforesting
affranchise, affranchised, affranchised, affranchising
affright, affrighted, affrighted, affrighting
affront, affronted, affronted, affronting
age, aged, aged, aging
agenise, agenised, agenised, agenising
agenize, agenized, agenized, agenizing
agglomerate, agglomerated, agglomerated, agglomerating
agglutinate, agglutinated, agglutinated, agglutinating
aggrade, aggraded, aggraded, aggrading
aggrandise, aggrandised, aggrandised, aggrandising
aggrandize, aggrandized, aggrandized, aggrandizing
aggravate, aggravated, aggravated, aggravating
aggregate, aggregated, aggregated, aggregating
aggress, aggressed, aggressed, aggressing
aggrieve, aggrieved, aggrieved, aggrieving
aggroup, aggrouped, aggrouped, aggrouping
agitate, agitated, agitated, agitating
agnise, agnised, agnised, agnising
agnize, agnized, agnized, agnizing
agonise, agonised, agonised, agonising
agonize, agonized, agonized, agonizing
agree, agreed, agreed, agreing
aid, aided, aided, aiding
ail, ailed, ailed, ailing
aim, aimed, aimed, aiming
air, aired, aired, airing
air-condition, air-conditioned, air-conditioned, air-conditioning
air-cool, air-cooled, air-cooled, air-cooling
air-drop, air-droped, air-droped, air-droping
air-freight, air-freighted, air-freighted, air-freighting
air-ship, air-shiped, air-shiped, air-shiping
air-slake, air-slaked, air-slaked, air-slaking
airbrush, airbrushed, airbrushed, airbrushing
airfreight, airfreighted, airfreighted, airfreighting
airlift, airlifted, airlifted, airlifting
airmail, airmailed, airmailed, airmailing
airt, airted, airted, airting
alarm, alarmed, alarmed, alarming
alchemise, alchemised, alchemised, alchemising
alchemize, alchemized, alchemized, alchemizing
alcoholise, alcoholised, alcoholised, alcoholising
alcoholize, alcoholized, alcoholized, alcoholizing
alert, alerted, alerted, alerting
alibi, alibied, alibied, alibiing
alien, aliened, aliened, aliening
alienate, alienated, alienated, alienating
alight, alighted, alighted, alighting
align, aligned, aligned, aligning
aliment, alimented, alimented, alimenting
aline, alined, alined, alining
alkalify, alkalified, alkalified, alkalifying
alkalinise, alkalinised, alkalinised, alkalinising
alkalinize, alkalinized, alkalinized, alkalinizing
alkalise, alkalised, alkalised, alkalising
alkalize, alkalized, alkalized, alkalizing
allay, allaied, allaied, allaying
allege, alleged, alleged, alleging
allegorise, allegorised, allegorised, allegorising
allegorize, allegorized, allegorized, allegorizing
alleviate, alleviated, alleviated, alleviating
alligator, alligatored, alligatored, alligatoring
alliterate, alliterated, alliterated, alliterating
allocate, allocated, allocated, allocating
allot, alloted, alloted, alloting
allow, allowed, allowed, allowing
allowance, allowanced, allowanced, allowancing
alloy, alloied, alloied, alloying
allude, alluded, alluded, alluding
allure, allured, allured, alluring
ally, allied, allied, allying
alphabetise, alphabetised, alphabetised, alphabetising
alphabetize, alphabetized, alphabetized, alphabetizing
alter, altered, altered, altering
altercate, altercated, altercated, altercating
alternate, alternated, alternated, alternating
aluminise, aluminised, aluminised, aluminising
aluminize, aluminized, aluminized, aluminizing
amalgamate, amalgamated, amalgamated, amalgamating
amass, amassed, amassed, amassing
amaze, amazed, amazed, amazing
ambition, ambitioned, ambitioned, ambitioning
amble, ambled, ambled, ambling
ambulate, ambulated, ambulated, ambulating
ambuscade, ambuscaded, ambuscaded, ambuscading
ambush, ambushed, ambushed, ambushing
ameliorate, ameliorated, ameliorated, ameliorating
amend, amended, amended, amending
amerce, amerced, amerced, amercing
americanise, americanised, americanised, americanising
americanize, americanized, americanized, americanizing
ammoniate, ammoniated, ammoniated, ammoniating
ammonify, ammonified, ammonified, ammonifying
amnesty, amnestied, amnestied, amnestying
amortise, amortised, amortised, amortising
amortize, amortized, amortized, amortizing
amount, amounted, amounted, amounting
amplify, amplified, amplified, amplifying
amputate, amputated, amputated, amputating
amuse, amused, amused, amusing
anaesthetise, anaesthetised, anaesthetised, anaesthetising
anaesthetize, anaesthetized, anaesthetized, anaesthetizing
anagram, anagramed, anagramed, anagraming
anagrammatise, anagrammatised, anagrammatised, anagrammatising
anagrammatize, anagrammatized, anagrammatized, anagrammatizing
analogise, analogised, analogised, analogising
analogize, analogized, analogized, analogizing
analyse, analysed, analysed, analysing
analyze, analyzed, analyzed, analyzing
anastomose, anastomosed, anastomosed, anastomosing
anathematise, anathematised, anathematised, anathematising
anathematize, anathematized, anathematized, anathematizing
anathemise, anathemised, anathemised, anathemising
anathemize, anathemized, anathemized, anathemizing
anatomise, anatomised, anatomised, anatomising
anatomize, anatomized, anatomized, anatomizing
anchor, anchored, anchored, anchoring
ancylose, ancylosed, ancylosed, ancylosing
anele, aneled, aneled, aneling
anesthetise, anesthetised, anesthetised, anesthetising
anesthetize, anesthetized, anesthetized, anesthetizing
anger, angered, angered, angering
angle, angled, angled, angling
angle-park, angle-parked, angle-parked, angle-parking
anglicise, anglicised, anglicised, anglicising
anglicize, anglicized, anglicized, anglicizing
anguish, anguished, anguished, anguishing
angulate, angulated, angulated, angulating
animadvert, animadverted, animadverted, animadverting
animalise, animalised, animalised, animalising
animalize, animalized, animalized, animalizing
animate, animated, animated, animating
animise, animised, animised, animising
animize, animized, animized, animizing
ankylose, ankylosed, ankylosed, ankylosing
anneal, annealed, annealed, annealing
annex, annexed, annexed, annexing
annihilate, annihilated, annihilated, annihilating
annotate, annotated, annotated, annotating
announce, announced, announced, announcing
annoy, annoied, annoied, annoying
annul, annuled, annuled, annuling
annunciate, annunciated, annunciated, annunciating
anodise, anodised, anodised, anodising
anodize, anodized, anodized, anodizing
anoint, anointed, anointed, anointing
answer, answered, answered, answering
antagonise, antagonised, antagonised, antagonising
antagonize, antagonized, antagonized, antagonizing
ante, anted, anted, anting
antecede, anteceded, anteceded, anteceding
antedate, antedated, antedated, antedating
anthologise, anthologised, anthologised, anthologising
anthologize, anthologized, anthologized, anthologizing
anthropomorphise, anthropomorphised, anthropomorphised, anthropomorphising
anthropomorphize, anthropomorphized, anthropomorphized, anthropomorphizing
antic, anticed, anticed, anticing
anticipate, anticipated, anticipated, anticipating
antiquate, antiquated, antiquated, antiquating
antique, antiqued, antiqued, antiquing
antisepticize, antisepticized, antisepticized, antisepticizing
ape, aped, aped, aping
aphorise, aphorised, aphorised, aphorising
aphorize, aphorized, aphorized, aphorizing
apologise, apologised, apologised, apologising
apologize, apologized, apologized, apologizing
apostatise, apostatised, apostatised, apostatising
apostatize, apostatized, apostatized, apostatizing
apostrophise, apostrophised, apostrophised, apostrophising
apostrophize, apostrophized, apostrophized, apostrophizing
apotheose, apotheosed, apotheosed, apotheosing
apotheosise, apotheosised, apotheosised, apotheosising
apotheosize, apotheosized, apotheosized, apotheosizing
appal, appaled, appaled, appaling
appall, appalled, appalled, appalling
apparel, appareled, appareled, appareling
appeal, appealed, appealed, appealing
appear, appeared, appeared, appearing
appease, appeased, appeased, appeasing
append, appended, appended, appending
apperceive, apperceived, apperceived, apperceiving
appertain, appertained, appertained, appertaining
applaud, applauded, applauded, applauding
applique, appliqued, appliqued, appliquing
apply, applied, applied, applying
appoint, appointed, appointed, appointing
apportion, apportioned, apportioned, apportioning
appose, apposed, apposed, apposing
appraise, appraised, appraised, appraising
appreciate, appreciated, appreciated, appreciating
apprehend, apprehended, apprehended, apprehending
apprentice, apprenticed, apprenticed, apprenticing
apprise, apprised, apprised, apprising
apprize, apprized, apprized, apprizing
approach, approached, approached, approaching
approbate, approbated, approbated, approbating
appropriate, appropriated, appropriated, appropriating
approve, approved, approved, approving
approximate, approximated, approximated, approximating
aquaplane, aquaplaned, aquaplaned, aquaplaning
aquatint, aquatinted, aquatinted, aquatinting
arbitrage, arbitraged, arbitraged, arbitraging
arbitrate, arbitrated, arbitrated, arbitrating
arborise, arborised, arborised, arborising
arborize, arborized, arborized, arborizing
arc, arced, arced, arcing
arch, arched, arched, arching
archaise, archaised, archaised, archaising
archaize, archaized, archaized, archaizing
archive, archived, archived, archiving
argue, argued, argued, arguing
argufy, argufied, argufied, argufying
arise, arised, arised, arising
arm, armed, armed, arming
armor, armored, armored, armoring
armour, armoured, armoured, armouring
aromatise, aromatised, aromatised, aromatising
aromatize, aromatized, aromatized, aromatizing
arouse, aroused, aroused, arousing
arraign, arraigned, arraigned, arraigning
arrange, arranged, arranged, arranging
array, arraied, arraied, arraying
arrest, arrested, arrested, arresting
arrive, arrived, arrived, arriving
arrogate, arrogated, arrogated, arrogating
arterialise, arterialised, arterialised, arterialising
arterialize, arterialized, arterialized, arterializing
article, articled, articled, articling
articulate, articulated, articulated, articulating
ascend, ascended, ascended, ascending
ascertain, ascertained, ascertained, ascertaining
ascribe, ascribed, ascribed, ascribing
ash, ashed, ashed, ashing
ask, asked, asked, asking
asperse, aspersed, aspersed, aspersing
asphalt, asphalted, asphalted, asphalting
asphyxiate, asphyxiated, asphyxiated, asphyxiating
aspirate, aspirated, aspirated, aspirating
aspire, aspired, aspired, aspiring
assail, assailed, assailed, assailing
assassinate, assassinated, assassinated, assassinating
assault, assaulted, assaulted, assaulting
assay, assaied, assaied, assaying
assemble, assembled, assembled, assembling
assent, assented, assented, assenting
assert, asserted, asserted, asserting
assess, assessed, assessed, assessing
asseverate, asseverated, asseverated, asseverating
assibilate, assibilated, assibilated, assibilating
assign, assigned, assigned, assigning
assimilate, assimilated, assimilated, assimilating
assist, assisted, assisted, assisting
associate, associated, associated, associating
assoil, assoiled, assoiled, assoiling
assonate, assonated, assonated, assonating
assort, assorted, assorted, assorting
assuage, assuaged, assuaged, assuaging
assume, assumed, assumed, assuming
assure, assured, assured, assuring
asterisk, asterisked, asterisked, asterisking
astonish, astonished, astonished, astonishing
astound, astounded, astounded, astounding
astringe, astringed, astringed, astringing
astrogate, astrogated, astrogated, astrogating
atom-bomb, atom-bombed, atom-bombed, atom-bombing
atomise, atomised, atomised, atomising
atomize, atomized, atomized, atomizing
atone, atoned, atoned, atoning
atrophy, atrophied, atrophied, atrophying
attach, attached, attached, attaching
attack, attacked, attacked, attacking
attain, attained, attained, attaining
attaint, attainted, attainted, attainting
attemper, attempered, attempered, attempering
attempt, attempted, attempted, attempting
attend, attended, attended, attending
attenuate, attenuated, attenuated, attenuating
attest, attested, attested, attesting
attire, attired, attired, attiring
attitudinise, attitudinised, attitudinised, attitudinising
attitudinize, attitudinized, attitudinized, attitudinizing
attorn, attorned, attorned, attorning
attract, attracted, attracted, attracting
attribute, attributed, attributed, attributing
attune, attuned, attuned, attuning
auction, auctioned, auctioned, auctioning
auctioneer, auctioneered, auctioneered, auctioneering
audit, audited, audited, auditing
audition, auditioned, auditioned, auditioning
augment, augmented, augmented, augmenting
augur, augured, augured, auguring
aurify, aurified, aurified, aurifying
auscultate, auscultated, auscultated, auscultating
auspicate, auspicated, auspicated, auspicating
authenticate, authenticated, authenticated, authenticating
author, authored, authored, authoring
authorise, authorised, authorised, authorising
authorize, authorized, authorized, authorizing
autoclave, autoclaved, autoclaved, autoclaving
autograph, autographed, autographed, autographing
automate, automated, automated, automating
automatise, automatised, automatised, automatising
automatize, automatized, automatized, automatizing
automobile, automobiled, automobiled, automobiling
autopsy, autopsied, autopsied, autopsying
autotomise, autotomised, autotomised, autotomising
autotomize, autotomized, autotomized, autotomizing
avail, availed, availed, availing
avalanche, avalanched, avalanched, avalanching
avenge, avenged, avenged, avenging
aver, avered, avered, avering
average, averaged, averaged, averaging
avert, averted, averted, averting
avianise, avianised, avianised, avianising
avianize, avianized, avianized, avianizing
aviate, aviated, aviated, aviating
avoid, avoided, avoided, avoiding
avouch, avouched, avouched, avouching
avow, avowed, avowed, avowing
avulse, avulsed, avulsed, avulsing
await, awaited, awaited, awaiting
awake, awaked, awaked, awaking
awaken, awakened, awakened, awakening
award, awarded, awarded, awarding
awe, awed, awed, awing
ax, axed, axed, axing
axe, axed, axed, axing
azure, azured, azured, azuring
baa, baaed, baaed, baaing
babbitt, babbitted, babbitted, babbitting
babble, babbled, babbled, babbling
baby, babied, babied, babying
baby-sit, baby-sited, baby-sited, baby-siting
babysit, babysited, babysited, babysiting
bach, bached, bached, baching
bachelor, bachelored, bachelored, bacheloring
back, backed, backed, backing
backbite, backbited, backbited, backbiting
backcross, backcrossed, backcrossed, backcrossing
backdate, backdated, backdated, backdating
backfire, backfired, backfired, backfiring
backflip, backflipped, backflipped, backflipping
background, backgrounded, backgrounded, backgrounding
backhand, backhanded, backhanded, backhanding
backlash, backlashed, backlashed, backlashing
backlog, backloged, backloged, backloging
backpack, backpacked, backpacked, backpacking
backpedal, backpedaled, backpedaled, backpedaling
backscatter, backscattered, backscattered, backscattering
backslap, backslaped, backslaped, backslaping
backslide, backslided, backslided, backsliding
backspace, backspaced, backspaced, backspacing
backstitch, backstitched, backstitched, backstitching
backstop, backstoped, backstoped, backstoping
backstroke, backstroked, backstroked, backstroking
backtrack, backtracked, backtracked, backtracking
bacterise, bacterised, bacterised, bacterising
bacterize, bacterized, bacterized, bacterizing
badge, badged, badged, badging
badger, badgered, badgered, badgering
badmouth, badmouthed, badmouthed, badmouthing
baffle, baffled, baffled, baffling
bag, baged, baged, baging
bail, bailed, bailed, bailing
bait, baited, baited, baiting
bake, baked, baked, baking
balance, balanced, balanced, balancing
bald, balded, balded, balding
bale, baled, baled, baling
balk, balked, balked, balking
balkanise, balkanised, balkanised, balkanising
balkanize, balkanized, balkanized, balkanizing
ball, balled, balled, balling
ballast, ballasted, ballasted, ballasting
balloon, ballooned, ballooned, ballooning
ballot, balloted, balloted, balloting
ballyhoo, ballyhooed, ballyhooed, ballyhooing
ballyrag, ballyraged, ballyraged, ballyraging
bamboozle, bamboozled, bamboozled, bamboozling
ban, baned, baned, baning
band, banded, banded, banding
bandage, bandaged, bandaged, bandaging
bandy, bandied, bandied, bandying
bang, banged, banged, banging
banish, banished, banished, banishing
bank, banked, banked, banking
bankroll, bankrolled, bankrolled, bankrolling
bankrupt, bankrupted, bankrupted, bankrupting
banquet, banqueted, banqueted, banqueting
banter, bantered, bantered, bantering
baptise, baptised, baptised, baptising
baptize, baptized, baptized, baptizing
bar, bared, bared, baring
barb, barbed, barbed, barbing
barbarise, barbarised, barbarised, barbarising
barbarize, barbarized, barbarized, barbarizing
barbecue, barbecued, barbecued, barbecuing
barbeque, barbequed, barbequed, barbequing
barber, barbered, barbered, barbering
bard, barded, barded, barding
barde, barded, barded, barding
bare, bared, bared, baring
barf, barfed, barfed, barfing
bargain, bargained, bargained, bargaining
barge, barged, barged, barging
bark, barked, barked, barking
barnstorm, barnstormed, barnstormed, barnstorming
baronetise, baronetised, baronetised, baronetising
baronetize, baronetized, baronetized, baronetizing
barrack, barracked, barracked, barracking
barrage, barraged, barraged, barraging
barrel, barreled, barreled, barreling
barricade, barricaded, barricaded, barricading
barricado, barricadoed, barricadoed, barricadoing
barter, bartered, bartered, bartering
base, based, based, basing
bash, bashed, bashed, bashing
basify, basified, basified, basifying
bask, basked, basked, basking
basset, basseted, basseted, basseting
bastardise, bastardised, bastardised, bastardising
bastardize, bastardized, bastardized, bastardizing
baste, basted, basted, basting
bastinado, bastinadoed, bastinadoed, bastinadoing
bat, bated, bated, bating
batch, batched, batched, batching
bate, bated, bated, bating
batfowl, batfowled, batfowled, batfowling
bathe, bathed, bathed, bathing
batik, batiked, batiked, batiking
batten, battened, battened, battening
batter, battered, battered, battering
battle, battled, battled, battling
baulk, baulked, baulked, baulking
bawl, bawled, bawled, bawling
bay, baied, baied, baying
bayonet, bayoneted, bayoneted, bayoneting
be, bed, bed, bing
beach, beached, beached, beaching
beacon, beaconed, beaconed, beaconing
bead, beaded, beaded, beading
beak, beaked, beaked, beaking
beam, beamed, beamed, beaming
bean, beaned, beaned, beaning
bear, beared, beared, bearing
beard, bearded, bearded, bearding
beat, beated, beated, beating
beatify, beatified, beatified, beatifying
beautify, beautified, beautified, beautifying
beaver, beavered, beavered, beavering
bebop, beboped, beboped, beboping
becalm, becalmed, becalmed, becalming
bechance, bechanced, bechanced, bechancing
becharm, becharmed, becharmed, becharming
beckon, beckoned, beckoned, beckoning
becloud, beclouded, beclouded, beclouding
become, becomed, becomed, becoming
bed, beded, beded, beding
bed-hop, bed-hoped, bed-hoped, bed-hoping
bedamn, bedamned, bedamned, bedamning
bedaub, bedaubed, bedaubed, bedaubing
bedaze, bedazed, bedazed, bedazing
bedazzle, bedazzled, bedazzled, bedazzling
bedeck, bedecked, bedecked, bedecking
bedevil, bedeviled, bedeviled, bedeviling
bedew, bedewed, bedewed, bedewing
bedhop, bedhoped, bedhoped, bedhoping
bedight, bedighted, bedighted, bedighting
bedim, bedimed, bedimed, bediming
bedizen, bedizened, bedizened, bedizening
bedraggle, bedraggled, bedraggled, bedraggling
beef, beefed, beefed, beefing
beep, beeped, beeped, beeping
beeswax, beeswaxed, beeswaxed, beeswaxing
beetle, beetled, beetled, beetling
befall, befalled, befalled, befalling
befit, befited, befited, befiting
befog, befoged, befoged, befoging
befool, befooled, befooled, befooling
befoul, befouled, befouled, befouling
befriend, befriended, befriended, befriending
befuddle, befuddled, befuddled, befuddling
beg, beged, beged, beging
beget, begeted, begeted, begeting
beggar, beggared, beggared, beggaring
