crimson, crimsoned, crimsoned, crimsoning
cringe, cringed, cringed, cringing
crinkle, crinkled, crinkled, crinkling
cripple, crippled, crippled, crippling
crisp, crisped, crisped, crisping
crispen, crispened, crispened, crispening
crisscross, crisscrossed, crisscrossed, crisscrossing
criticise, criticised, criticised, criticising
criticize, criticized, criticized, criticizing
critique, critiqued, critiqued, critiquing
croak, croaked, croaked, croaking
crochet, crocheted, crocheted, crocheting
crock, crocked, crocked, crocking
cronk, cronked, cronked, cronking
crook, crooked, crooked, crooking
croon, crooned, crooned, crooning
crop, croped, croped, croping
croquet, croqueted, croqueted, croqueting
cross, crossed, crossed, crossing
cross-check, cross-checked, cross-checked, cross-checking
cross-dress, cross-dressed, cross-dressed, cross-dressing
cross-fertilise, cross-fertilised, cross-fertilised, cross-fertilising
cross-fertilize, cross-fertilized, cross-fertilized, cross-fertilizing
cross-file, cross-filed, cross-filed, cross-filing
cross-index, cross-indexed, cross-indexed, cross-indexing
cross-link, cross-linked, cross-linked, cross-linking
cross-pollinate, cross-pollinated, cross-pollinated, cross-pollinating
cross-refer, cross-refered, cross-refered, cross-refering
crossbreed, crossbreeded, crossbreeded, crossbreeding
crosscut, crosscuted, crosscuted, crosscuting
crosshatch, crosshatched, crosshatched, crosshatching
crossruff, crossruffed, crossruffed, crossruffing
crouch, crouched, crouched, crouching
crow, crowed, crowed, crowing
crowd, crowded, crowded, crowding
crown, crowned, crowned, crowning
crucify, crucified, crucified, crucifying
cruise, cruised, cruised, cruising
crumb, crumbed, crumbed, crumbing
crumble, crumbled, crumbled, crumbling
crump, crumped, crumped, crumping
crumple, crumpled, crumpled, crumpling
crunch, crunched, crunched, crunching
crusade, crusaded, crusaded, crusading
crush, crushed, crushed, crushing
crust, crusted, crusted, crusting
cry, cried, cried, crying
crystalise, crystalised, crystalised, crystalising
crystalize, crystalized, crystalized, crystalizing
crystallise, crystallised, crystallised, crystallising
crystallize, crystallized, crystallized, crystallizing
cub, cubed, cubed, cubing
cube, cubed, cubed, cubing
cuckold, cuckolded, cuckolded, cuckolding
cuckoo, cuckooed, cuckooed, cuckooing
cuddle, cuddled, cuddled, cuddling
cudgel, cudgeled, cudgeled, cudgeling
cue, cued, cued, cuing
cuff, cuffed, cuffed, cuffing
cull, culled, culled, culling
culminate, culminated, culminated, culminating
cultivate, cultivated, cultivated, cultivating
culture, cultured, cultured, culturing
cumber, cumbered, cumbered, cumbering
cumulate, cumulated, cumulated, cumulating
cup, cuped, cuped, cuping
curb, curbed, curbed, curbing
curdle, curdled, curdled, curdling
cure, cured, cured, curing
curl, curled, curled, curling
curry, curried, curried, currying
currycomb, currycombed, currycombed, currycombing
curse, cursed, cursed, cursing
curtail, curtailed, curtailed, curtailing
curtain, curtained, curtained, curtaining
curtsey, curtseied, curtseied, curtseying
curtsy, curtsied, curtsied, curtsying
curve, curved, curved, curving
curvet, curveted, curveted, curveting
cushion, cushioned, cushioned, cushioning
cuss, cussed, cussed, cussing
custom-make, custom-maked, custom-maked, custom-making
customise, customised, customised, customising
customize, customized, customized, customizing
cut, cuted, cuted, cuting
cutinize, cutinized, cutinized, cutinizing
cybernate, cybernated, cybernated, cybernating
cycle, cycled, cycled, cycling
cyclostyle, cyclostyled, cyclostyled, cyclostyling
cypher, cyphered, cyphered, cyphering
dab, dabed, dabed, dabing
dabble, dabbled, dabbled, dabbling
dado, dadoed, dadoed, dadoing
daisy-chain, daisy-chained, daisy-chained, daisy-chaining
dally, dallied, dallied, dallying
dam, damed, damed, daming
damage, damaged, damaged, damaging
damascene, damascened, damascened, damascening
damn, damned, damned, damning
damp, damped, damped, damping
dampen, dampened, dampened, dampening
dance, danced, danced, dancing
dandify, dandified, dandified, dandifying
dandle, dandled, dandled, dandling
dangle, dangled, dangled, dangling
dapple, dappled, dappled, dappling
dare, dared, dared, daring
darken, darkened, darkened, darkening
darn, darned, darned, darning
dart, darted, darted, darting
dash, dashed, dashed, dashing
date, dated, dated, dating
date-mark, date-marked, date-marked, date-marking
dateline, datelined, datelined, datelining
datemark, datemarked, datemarked, datemarking
daub, daubed, daubed, daubing
daunt, daunted, daunted, daunting
dawdle, dawdled, dawdled, dawdling
dawn, dawned, dawned, dawning
daydream, daydreamed, daydreamed, daydreaming
daze, dazed, dazed, dazing
dazzle, dazzled, dazzled, dazzling
de-access, de-accessed, de-accessed, de-accessing
de-aerate, de-aerated, de-aerated, de-aerating
de-emphasise, de-emphasised, de-emphasised, de-emphasising
de-emphasize, de-emphasized, de-emphasized, de-emphasizing
de-energise, de-energised, de-energised, de-energising
de-energize, de-energized, de-energized, de-energizing
de-escalate, de-escalated, de-escalated, de-escalating
de-ice, de-iced, de-iced, de-icing
de-iodinate, de-iodinated, de-iodinated, de-iodinating
de-ionate, de-ionated, de-ionated, de-ionating
deaccession, deaccessioned, deaccessioned, deaccessioning
deactivate, deactivated, deactivated, deactivating
deaden, deadened, deadened, deadening
deaerate, deaerated, deaerated, deaerating
deaf, deafed, deafed, deafing
deafen, deafened, deafened, deafening
deal, dealed, dealed, dealing
deaminate, deaminated, deaminated, deaminating
deaminize, deaminized, deaminized, deaminizing
debar, debared, debared, debaring
debark, debarked, debarked, debarking
debase, debased, debased, debasing
debate, debated, debated, debating
debauch, debauched, debauched, debauching
debilitate, debilitated, debilitated, debilitating
debit, debited, debited, debiting
debone, deboned, deboned, deboning
debouch, debouched, debouched, debouching
debrief, debriefed, debriefed, debriefing
debug, debuged, debuged, debuging
debunk, debunked, debunked, debunking
debut, debuted, debuted, debuting
decaffeinate, decaffeinated, decaffeinated, decaffeinating
decalcify, decalcified, decalcified, decalcifying
decamp, decamped, decamped, decamping
decant, decanted, decanted, decanting
decapitate, decapitated, decapitated, decapitating
decarbonate, decarbonated, decarbonated, decarbonating
decarbonise, decarbonised, decarbonised, decarbonising
decarbonize, decarbonized, decarbonized, decarbonizing
decarboxylate, decarboxylated, decarboxylated, decarboxylating
decarburise, decarburised, decarburised, decarburising
decarburize, decarburized, decarburized, decarburizing
decay, decaied, decaied, decaying
decease, deceased, deceased, deceasing
deceive, deceived, deceived, deceiving
decelerate, decelerated, decelerated, decelerating
decentralise, decentralised, decentralised, decentralising
decentralize, decentralized, decentralized, decentralizing
decerebrate, decerebrated, decerebrated, decerebrating
decertify, decertified, decertified, decertifying
dechlorinate, dechlorinated, dechlorinated, dechlorinating
decide, decided, decided, deciding
decimalise, decimalised, decimalised, decimalising
decimalize, decimalized, decimalized, decimalizing
decimate, decimated, decimated, decimating
decipher, deciphered, deciphered, deciphering
deck, decked, decked, decking
declaim, declaimed, declaimed, declaiming
declare, declared, declared, declaring
declassify, declassified, declassified, declassifying
declaw, declawed, declawed, declawing
decline, declined, declined, declining
declutch, declutched, declutched, declutching
decoct, decocted, decocted, decocting
decode, decoded, decoded, decoding
decoke, decoked, decoked, decoking
decollate, decollated, decollated, decollating
decolonise, decolonised, decolonised, decolonising
decolonize, decolonized, decolonized, decolonizing
decolor, decolored, decolored, decoloring
decolorise, decolorised, decolorised, decolorising
decolorize, decolorized, decolorized, decolorizing
decolour, decoloured, decoloured, decolouring
decolourise, decolourised, decolourised, decolourising
decolourize, decolourized, decolourized, decolourizing
decommission, decommissioned, decommissioned, decommissioning
decompose, decomposed, decomposed, decomposing
decompress, decompressed, decompressed, decompressing
deconcentrate, deconcentrated, deconcentrated, deconcentrating
deconsecrate, deconsecrated, deconsecrated, deconsecrating
deconstruct, deconstructed, deconstructed, deconstructing
decontaminate, decontaminated, decontaminated, decontaminating
decontrol, decontroled, decontroled, decontroling
decorate, decorated, decorated, decorating
decorticate, decorticated, decorticated, decorticating
decouple, decoupled, decoupled, decoupling
decoy, decoied, decoied, decoying
decrease, decreased, decreased, decreasing
decree, decreed, decreed, decreing
decrepitate, decrepitated, decrepitated, decrepitating
decrescendo, decrescendoed, decrescendoed, decrescendoing
decriminalise, decriminalised, decriminalised, decriminalising
decriminalize, decriminalized, decriminalized, decriminalizing
decry, decried, decried, decrying
decrypt, decrypted, decrypted, decrypting
decussate, decussated, decussated, decussating
dedicate, dedicated, dedicated, dedicating
dedifferentiate, dedifferentiated, dedifferentiated, dedifferentiating
deduce, deduced, deduced, deducing
deduct, deducted, deducted, deducting
deem, deemed, deemed, deeming
deep-dye, deep-dyed, deep-dyed, deep-dying
deep-fat-fry, deep-fat-fried, deep-fat-fried, deep-fat-frying
deep-fry, deep-fried, deep-fried, deep-frying
deep-six, deep-sixed, deep-sixed, deep-sixing
deepen, deepened, deepened, deepening
deface, defaced, defaced, defacing
defalcate, defalcated, defalcated, defalcating
defame, defamed, defamed, defaming
defang, defanged, defanged, defanging
defat, defated, defated, defating
default, defaulted, defaulted, defaulting
defeat, defeated, defeated, defeating
defecate, defecated, defecated, defecating
defect, defected, defected, defecting
defeminise, defeminised, defeminised, defeminising
defeminize, defeminized, defeminized, defeminizing
defend, defended, defended, defending
defenestrate, defenestrated, defenestrated, defenestrating
defer, defered, defered, defering
defervesce, defervesced, defervesced, defervescing
defibrillate, defibrillated, defibrillated, defibrillating
defibrinate, defibrinated, defibrinated, defibrinating
defile, defiled, defiled, defiling
define, defined, defined, defining
deflagrate, deflagrated, deflagrated, deflagrating
deflate, deflated, deflated, deflating
deflect, deflected, deflected, deflecting
deflower, deflowered, deflowered, deflowering
defog, defoged, defoged, defoging
defoliate, defoliated, defoliated, defoliating
deforest, deforested, deforested, deforesting
deform, deformed, deformed, deforming
defraud, defrauded, defrauded, defrauding
defray, defraied, defraied, defraying
defrock, defrocked, defrocked, defrocking
defrost, defrosted, defrosted, defrosting
defuse, defused, defused, defusing
defy, defied, defied, defying
degas, degased, degased, degasing
degauss, degaussed, degaussed, degaussing
degenerate, degenerated, degenerated, degenerating
deglaze, deglazed, deglazed, deglazing
deglycerolise, deglycerolised, deglycerolised, deglycerolising
deglycerolize, deglycerolized, deglycerolized, deglycerolizing
degrade, degraded, degraded, degrading
degrease, degreased, degreased, degreasing
degust, degusted, degusted, degusting
dehisce, dehisced, dehisced, dehiscing
dehorn, dehorned, dehorned, dehorning
dehumanise, dehumanised, dehumanised, dehumanising
dehumanize, dehumanized, dehumanized, dehumanizing
dehumidify, dehumidified, dehumidified, dehumidifying
dehydrate, dehydrated, dehydrated, dehydrating
dehydrogenate, dehydrogenated, dehydrogenated, dehydrogenating
deice, deiced, deiced, deicing
deify, deified, deified, deifying
deign, deigned, deigned, deigning
deionize, deionized, deionized, deionizing
deject, dejected, dejected, dejecting
delay, delaied, delaied, delaying
delegate, delegated, delegated, delegating
delete, deleted, deleted, deleting
deliberate, deliberated, deliberated, deliberating
delight, delighted, delighted, delighting
delimit, delimited, delimited, delimiting
delimitate, delimitated, delimitated, delimitating
delineate, delineated, delineated, delineating
deliquesce, deliquesced, deliquesced, deliquescing
delist, delisted, delisted, delisting
deliver, delivered, delivered, delivering
delocalize, delocalized, delocalized, delocalizing
delouse, deloused, deloused, delousing
delude, deluded, deluded, deluding
deluge, deluged, deluged, deluging
delve, delved, delved, delving
demagnetise, demagnetised, demagnetised, demagnetising
demagnetize, demagnetized, demagnetized, demagnetizing
demand, demanded, demanded, demanding
demarcate, demarcated, demarcated, demarcating
demasculinise, demasculinised, demasculinised, demasculinising
demasculinize, demasculinized, demasculinized, demasculinizing
dematerialise, dematerialised, dematerialised, dematerialising
dematerialize, dematerialized, dematerialized, dematerializing
demean, demeaned, demeaned, demeaning
demilitarise, demilitarised, demilitarised, demilitarising
demilitarize, demilitarized, demilitarized, demilitarizing
demineralise, demineralised, demineralised, demineralising
demineralize, demineralized, demineralized, demineralizing
demise, demised, demised, demising
demist, demisted, demisted, demisting
demo, demoed, demoed, demoing
demob, demobed, demobed, demobing
demobilise, demobilised, demobilised, demobilising
demobilize, demobilized, demobilized, demobilizing
democratise, democratised, democratised, democratising
democratize, democratized, democratized, democratizing
demodulate, demodulated, demodulated, demodulating
demolish, demolished, demolished, demolishing
demonetise, demonetised, demonetised, demonetising
demonetize, demonetized, demonetized, demonetizing
demonise, demonised, demonised, demonising
demonize, demonized, demonized, demonizing
demonstrate, demonstrated, demonstrated, demonstrating
demoralise, demoralised, demoralised, demoralising
demoralize, demoralized, demoralized, demoralizing
demote, demoted, demoted, demoting
demulsify, demulsified, demulsified, demulsifying
demur, demured, demured, demuring
demyelinate, demyelinated, demyelinated, demyelinating
demystify, demystified, demystified, demystifying
demythologise, demythologised, demythologised, demythologising
demythologize, demythologized, demythologized, demythologizing
denationalise, denationalised, denationalised, denationalising
denationalize, denationalized, denationalized, denationalizing
denaturalise, denaturalised, denaturalised, denaturalising
denaturalize, denaturalized, denaturalized, denaturalizing
denature, denatured, denatured, denaturing
denazify, denazified, denazified, denazifying
denigrate, denigrated, denigrated, denigrating
denitrify, denitrified, denitrified, denitrifying
denominate, denominated, denominated, denominating
denote, denoted, denoted, denoting
denounce, denounced, denounced, denouncing
dent, dented, dented, denting
denudate, denudated, denudated, denudating
denude, denuded, denuded, denuding
deny, denied, denied, denying
deodorise, deodorised, deodorised, deodorising
deodorize, deodorized, deodorized, deodorizing
deodourise, deodourised, deodourised, deodourising
deoxidise, deoxidised, deoxidised, deoxidising
deoxidize, deoxidized, deoxidized, deoxidizing
deoxygenate, deoxygenated, deoxygenated, deoxygenating
depart, departed, departed, departing
depend, depended, depended, depending
depersonalise, depersonalised, depersonalised, depersonalising
depersonalize, depersonalized, depersonalized, depersonalizing
depict, depicted, depicted, depicting
depilate, depilated, depilated, depilating
deplane, deplaned, deplaned, deplaning
deplete, depleted, depleted, depleting
deplore, deplored, deplored, deploring
deploy, deploied, deploied, deploying
deplumate, deplumated, deplumated, deplumating
deplume, deplumed, deplumed, depluming
depolarise, depolarised, depolarised, depolarising
depolarize, depolarized, depolarized, depolarizing
depone, deponed, deponed, deponing
depopulate, depopulated, depopulated, depopulating
deport, deported, deported, deporting
depose, deposed, deposed, deposing
deposit, deposited, deposited, depositing
deprave, depraved, depraved, depraving
deprecate, deprecated, deprecated, deprecating
depreciate, depreciated, depreciated, depreciating
depress, depressed, depressed, depressing
depressurise, depressurised, depressurised, depressurising
depressurize, depressurized, depressurized, depressurizing
deprive, deprived, deprived, depriving
depute, deputed, deputed, deputing
deputise, deputised, deputised, deputising
deputize, deputized, deputized, deputizing
deracinate, deracinated, deracinated, deracinating
derail, derailed, derailed, derailing
derange, deranged, deranged, deranging
derate, derated, derated, derating
derecognise, derecognised, derecognised, derecognising
derecognize, derecognized, derecognized, derecognizing
deregulate, deregulated, deregulated, deregulating
derequisition, derequisitioned, derequisitioned, derequisitioning
derestrict, derestricted, derestricted, derestricting
deride, derided, derided, deriding
derive, derived, derived, deriving
derogate, derogated, derogated, derogating
desacralize, desacralized, desacralized, desacralizing
desalinate, desalinated, desalinated, desalinating
desalinise, desalinised, desalinised, desalinising
desalinize, desalinized, desalinized, desalinizing
desalt, desalted, desalted, desalting
descale, descaled, descaled, descaling
descant, descanted, descanted, descanting
descend, descended, descended, descending
describe, described, described, describing
descry, descried, descried, descrying
desecrate, desecrated, desecrated, desecrating
desegregate, desegregated, desegregated, desegregating
desensitise, desensitised, desensitised, desensitising
desensitize, desensitized, desensitized, desensitizing
desert, deserted, deserted, deserting
deserve, deserved, deserved, deserving
desex, desexed, desexed, desexing
desexualise, desexualised, desexualised, desexualising
desexualize, desexualized, desexualized, desexualizing
desiccate, desiccated, desiccated, desiccating
design, designed, designed, designing
designate, designated, designated, designating
desire, desired, desired, desiring
desist, desisted, desisted, desisting
desolate, desolated, desolated, desolating
desorb, desorbed, desorbed, desorbing
despair, despaired, despaired, despairing
despatch, despatched, despatched, despatching
despise, despised, despised, despising
despoil, despoiled, despoiled, despoiling
despond, desponded, desponded, desponding
desquamate, desquamated, desquamated, desquamating
destabilise, destabilised, destabilised, destabilising
destabilize, destabilized, destabilized, destabilizing
destain, destained, destained, destaining
destalinise, destalinised, destalinised, destalinising
destalinize, destalinized, destalinized, destalinizing
destine, destined, destined, destining
destress, destressed, destressed, destressing
destroy, destroied, destroied, destroying
destruct, destructed, destructed, destructing
desulfurize, desulfurized, desulfurized, desulfurizing
desulphurize, desulphurized, desulphurized, desulphurizing
desynchronise, desynchronised, desynchronised, desynchronising
desynchronize, desynchronized, desynchronized, desynchronizing
detach, detached, detached, detaching
detail, detailed, detailed, detailing
detain, detained, detained, detaining
detect, detected, detected, detecting
deter, detered, detered, detering
deterge, deterged, deterged, deterging
deteriorate, deteriorated, deteriorated, deteriorating
determine, determined, determined, determining
detest, detested, detested, detesting
dethaw, dethawed, dethawed, dethawing
dethrone, dethroned, dethroned, dethroning
detick, deticked, deticked, deticking
detonate, detonated, detonated, detonating
detour, detoured, detoured, detouring
detox, detoxed, detoxed, detoxing
detoxicate, detoxicated, detoxicated, detoxicating
detoxify, detoxified, detoxified, detoxifying
detract, detracted, detracted, detracting
detrain, detrained, detrained, detraining
detransitivise, detransitivised, detransitivised, detransitivising
detransitivize, detransitivized, detransitivized, detransitivizing
detribalise, detribalised, detribalised, detribalising
detribalize, detribalized, detribalized, detribalizing
detusk, detusked, detusked, detusking
devaluate, devaluated, devaluated, devaluating
devalue, devalued, devalued, devaluing
devastate, devastated, devastated, devastating
devein, deveined, deveined, deveining
develop, developed, developed, developing
deviate, deviated, deviated, deviating
devil, deviled, deviled, deviling
devilise, devilised, devilised, devilising
devilize, devilized, devilized, devilizing
devise, devised, devised, devising
devitalise, devitalised, devitalised, devitalising
devitalize, devitalized, devitalized, devitalizing
devitrify, devitrified, devitrified, devitrifying
devoice, devoiced, devoiced, devoicing
devolve, devolved, devolved, devolving
devote, devoted, devoted, devoting
devour, devoured, devoured, devouring
diabolise, diabolised, diabolised, diabolising
diabolize, diabolized, diabolized, diabolizing
diagnose, diagnosed, diagnosed, diagnosing
diagonalise, diagonalised, diagonalised, diagonalising
diagonalize, diagonalized, diagonalized, diagonalizing
diagram, diagramed, diagramed, diagraming
dial, dialed, dialed, dialing
dialyse, dialysed, dialysed, dialysing
dialyze, dialyzed, dialyzed, dialyzing
diazotize, diazotized, diazotized, diazotizing
dibble, dibbled, dibbled, dibbling
dice, diced, diced, dicing
dichotomise, dichotomised, dichotomised, dichotomising
dichotomize, dichotomized, dichotomized, dichotomizing
dicker, dickered, dickered, dickering
dictate, dictated, dictated, dictating
didder, diddered, diddered, diddering
diddle, diddled, diddled, diddling
die, died, died, diing
diet, dieted, dieted, dieting
differ, differed, differed, differing
differentiate, differentiated, differentiated, differentiating
diffract, diffracted, diffracted, diffracting
diffuse, diffused, diffused, diffusing
dig, diged, diged, diging
digest, digested, digested, digesting
digitalise, digitalised, digitalised, digitalising
digitalize, digitalized, digitalized, digitalizing
digitise, digitised, digitised, digitising
digitize, digitized, digitized, digitizing
dignify, dignified, dignified, dignifying
digress, digressed, digressed, digressing
dike, diked, diked, diking
dilapidate, dilapidated, dilapidated, dilapidating
dilate, dilated, dilated, dilating
dilly-dally, dilly-dallied, dilly-dallied, dilly-dallying
dillydally, dillydallied, dillydallied, dillydallying
dilute, diluted, diluted, diluting
dim, dimed, dimed, diming
dimension, dimensioned, dimensioned, dimensioning
diminish, diminished, diminished, diminishing
dimple, dimpled, dimpled, dimpling
din, dined, dined, dining
dine, dined, dined, dining
ding, dinged, dinged, dinging
dingdong, dingdonged, dingdonged, dingdonging
dinge, dinged, dinged, dinging
dip, diped, diped, diping
diphthongise, diphthongised, diphthongised, diphthongising
diphthongize, diphthongized, diphthongized, diphthongizing
direct, directed, directed, directing
dirty, dirtied, dirtied, dirtying
disable, disabled, disabled, disabling
disabuse, disabused, disabused, disabusing
disaccord, disaccorded, disaccorded, disaccording
disadvantage, disadvantaged, disadvantaged, disadvantaging
disaffect, disaffected, disaffected, disaffecting
disafforest, disafforested, disafforested, disafforesting
disagree, disagreed, disagreed, disagreing
disallow, disallowed, disallowed, disallowing
disambiguate, disambiguated, disambiguated, disambiguating
disappear, disappeared, disappeared, disappearing
disappoint, disappointed, disappointed, disappointing
disapprove, disapproved, disapproved, disapproving
disarm, disarmed, disarmed, disarming
disarrange, disarranged, disarranged, disarranging
disarray, disarraied, disarraied, disarraying
disarticulate, disarticulated, disarticulated, disarticulating
disassemble, disassembled, disassembled, disassembling
disassociate, disassociated, disassociated, disassociating
disavow, disavowed, disavowed, disavowing
disband, disbanded, disbanded, disbanding
disbar, disbared, disbared, disbaring
disbelieve, disbelieved, disbelieved, disbelieving
disbud, disbuded, disbuded, disbuding
disburden, disburdened, disburdened, disburdening
disburse, disbursed, disbursed, disbursing
disc-jockey, disc-jockeied, disc-jockeied, disc-jockeying
discard, discarded, discarded, discarding
discase, discased, discased, discasing
discern, discerned, discerned, discerning
discerp, discerped, discerped, discerping
discharge, discharged, discharged, discharging
discipline, disciplined, disciplined, disciplining
disclaim, disclaimed, disclaimed, disclaiming
disclose, disclosed, disclosed, disclosing
disco, discoed, discoed, discoing
discolor, discolored, discolored, discoloring
discolorise, discolorised, discolorised, discolorising
discolorize, discolorized, discolorized, discolorizing
discolour, discoloured, discoloured, discolouring
discolourise, discolourised, discolourised, discolourising
discombobulate, discombobulated, discombobulated, discombobulating
discomfit, discomfited, discomfited, discomfiting
discommode, discommoded, discommoded, discommoding
discompose, discomposed, discomposed, discomposing
disconcert, disconcerted, disconcerted, disconcerting
disconnect, disconnected, disconnected, disconnecting
discontent, discontented, discontented, discontenting
discontinue, discontinued, discontinued, discontinuing
discord, discorded, discorded, discording
discount, discounted, discounted, discounting
