handbuild, handbuilded, handbuilded, handbuilding
handcolor, handcolored, handcolored, handcoloring
handcolour, handcoloured, handcoloured, handcolouring
handcraft, handcrafted, handcrafted, handcrafting
handcuff, handcuffed, handcuffed, handcuffing
handicap, handicaped, handicaped, handicaping
handle, handled, handled, handling
handstamp, handstamped, handstamped, handstamping
handwash, handwashed, handwashed, handwashing
handwrite, handwrited, handwrited, handwriting
hang, hanged, hanged, hanging
hanker, hankered, hankered, hankering
hap, haped, haped, haping
happen, happened, happened, happening
harangue, harangued, harangued, haranguing
harass, harassed, harassed, harassing
harbinger, harbingered, harbingered, harbingering
harbor, harbored, harbored, harboring
harbour, harboured, harboured, harbouring
harden, hardened, hardened, hardening
hare, hared, hared, haring
hark, harked, harked, harking
harken, harkened, harkened, harkening
harlequin, harlequined, harlequined, harlequining
harm, harmed, harmed, harming
harmonise, harmonised, harmonised, harmonising
harmonize, harmonized, harmonized, harmonizing
harness, harnessed, harnessed, harnessing
harp, harped, harped, harping
harpoon, harpooned, harpooned, harpooning
harrow, harrowed, harrowed, harrowing
harry, harried, harried, harrying
harshen, harshened, harshened, harshening
harvest, harvested, harvested, harvesting
hash, hashed, hashed, hashing
hasp, hasped, hasped, hasping
hassle, hassled, hassled, hassling
hasten, hastened, hastened, hastening
hat, hated, hated, hating
hatch, hatched, hatched, hatching
hatchel, hatcheled, hatcheled, hatcheling
hate, hated, hated, hating
haul, hauled, hauled, hauling
haunt, haunted, haunted, haunting
have, haved, haved, having
haw, hawed, hawed, hawing
hawk, hawked, hawked, hawking
hay, haied, haied, haying
hazard, hazarded, hazarded, hazarding
haze, hazed, hazed, hazing
head, headed, headed, heading
headbutt, headbutted, headbutted, headbutting
headline, headlined, headlined, headlining
headquarter, headquartered, headquartered, headquartering
heal, healed, healed, healing
heap, heaped, heaped, heaping
hear, heared, heared, hearing
hearken, hearkened, hearkened, hearkening
hearten, heartened, heartened, heartening
heat, heated, heated, heating
heave, heaved, heaved, heaving
heckle, heckled, heckled, heckling
hectograph, hectographed, hectographed, hectographing
hector, hectored, hectored, hectoring
hedge, hedged, hedged, hedging
hedgehop, hedgehoped, hedgehoped, hedgehoping
hee-haw, hee-hawed, hee-hawed, hee-hawing
heed, heeded, heeded, heeding
heel, heeled, heeled, heeling
heft, hefted, hefted, hefting
heighten, heightened, heightened, heightening
heist, heisted, heisted, heisting
heliograph, heliographed, heliographed, heliographing
helm, helmed, helmed, helming
help, helped, helped, helping
hem, hemed, hemed, heming
hemagglutinate, hemagglutinated, hemagglutinated, hemagglutinating
hemorrhage, hemorrhaged, hemorrhaged, hemorrhaging
hemstitch, hemstitched, hemstitched, hemstitching
hen-peck, hen-pecked, hen-pecked, hen-pecking
henna, hennaed, hennaed, hennaing
herald, heralded, heralded, heralding
herd, herded, herded, herding
hero-worship, hero-worshiped, hero-worshiped, hero-worshiping
hesitate, hesitated, hesitated, hesitating
heterodyne, heterodyned, heterodyned, heterodyning
hew, hewed, hewed, hewing
hex, hexed, hexed, hexing
hibachi, hibachied, hibachied, hibachiing
hibernate, hibernated, hibernated, hibernating
hiccough, hiccoughed, hiccoughed, hiccoughing
hiccup, hiccuped, hiccuped, hiccuping
hide, hided, hided, hiding
hie, hied, hied, hiing
higgle, higgled, higgled, higgling
high-tail, high-tailed, high-tailed, high-tailing
highjack, highjacked, highjacked, highjacking
highlight, highlighted, highlighted, highlighting
hightail, hightailed, hightailed, hightailing
hijack, hijacked, hijacked, hijacking
hike, hiked, hiked, hiking
hill, hilled, hilled, hilling
hinder, hindered, hindered, hindering
hinge, hinged, hinged, hinging
hint, hinted, hinted, hinting
hire, hired, hired, hiring
hiss, hissed, hissed, hissing
hit, hited, hited, hiting
hitch, hitched, hitched, hitching
hitchhike, hitchhiked, hitchhiked, hitchhiking
hive, hived, hived, hiving
hoard, hoarded, hoarded, hoarding
hoax, hoaxed, hoaxed, hoaxing
hob, hobed, hobed, hobing
hobble, hobbled, hobbled, hobbling
hobnail, hobnailed, hobnailed, hobnailing
hobnob, hobnobed, hobnobed, hobnobing
hock, hocked, hocked, hocking
hoe, hoed, hoed, hoing
hog, hoged, hoged, hoging
hog-tie, hog-tied, hog-tied, hog-tiing
hoist, hoisted, hoisted, hoisting
hold, holded, holded, holding
hole, holed, holed, holing
holiday, holidaied, holidaied, holidaying
holler, hollered, hollered, hollering
hollo, holloed, holloed, holloing
hollow, hollowed, hollowed, hollowing
holystone, holystoned, holystoned, holystoning
home, homed, homed, homing
home-school, home-schooled, home-schooled, home-schooling
homer, homered, homered, homering
homestead, homesteaded, homesteaded, homesteading
homogenise, homogenised, homogenised, homogenising
homogenize, homogenized, homogenized, homogenizing
homologise, homologised, homologised, homologising
homologize, homologized, homologized, homologizing
hone, honed, honed, honing
honey, honeied, honeied, honeying
honeycomb, honeycombed, honeycombed, honeycombing
honeymoon, honeymooned, honeymooned, honeymooning
honk, honked, honked, honking
honor, honored, honored, honoring
honour, honoured, honoured, honouring
hood, hooded, hooded, hooding
hoodoo, hoodooed, hoodooed, hoodooing
hoodwink, hoodwinked, hoodwinked, hoodwinking
hoof, hoofed, hoofed, hoofing
hook, hooked, hooked, hooking
hoop, hooped, hooped, hooping
hoot, hooted, hooted, hooting
hoover, hoovered, hoovered, hoovering
hop, hoped, hoped, hoping
hop-skip, hop-skiped, hop-skiped, hop-skiping
hope, hoped, hoped, hoping
hopple, hoppled, hoppled, hoppling
horn, horned, horned, horning
hornswoggle, hornswoggled, hornswoggled, hornswoggling
horrify, horrified, horrified, horrifying
horripilate, horripilated, horripilated, horripilating
horse, horsed, horsed, horsing
horse-race, horse-raced, horse-raced, horse-racing
horse-trade, horse-traded, horse-traded, horse-trading
horseshoe, horseshoed, horseshoed, horseshoing
horsewhip, horsewhiped, horsewhiped, horsewhiping
hose, hosed, hosed, hosing
hospitalise, hospitalised, hospitalised, hospitalising
hospitalize, hospitalized, hospitalized, hospitalizing
host, hosted, hosted, hosting
hot-dog, hot-doged, hot-doged, hot-doging
hot-wire, hot-wired, hot-wired, hot-wiring
hot-work, hot-worked, hot-worked, hot-working
hotfoot, hotfooted, hotfooted, hotfooting
hound, hounded, hounded, hounding
house, housed, housed, housing
house-train, house-trained, house-trained, house-training
housebreak, housebreaked, housebreaked, housebreaking
houseclean, housecleaned, housecleaned, housecleaning
housekeep, housekeeped, housekeeped, housekeeping
hover, hovered, hovered, hovering
howl, howled, howled, howling
huckster, huckstered, huckstered, huckstering
huddle, huddled, huddled, huddling
hue, hued, hued, huing
huff, huffed, huffed, huffing
hug, huged, huged, huging
hulk, hulked, hulked, hulking
hull, hulled, hulled, hulling
hum, humed, humed, huming
humanise, humanised, humanised, humanising
humanize, humanized, humanized, humanizing
humble, humbled, humbled, humbling
humbug, humbuged, humbuged, humbuging
humidify, humidified, humidified, humidifying
humify, humified, humified, humifying
humiliate, humiliated, humiliated, humiliating
humor, humored, humored, humoring
humour, humoured, humoured, humouring
hump, humped, humped, humping
hunch, hunched, hunched, hunching
hunger, hungered, hungered, hungering
hunker, hunkered, hunkered, hunkering
hunt, hunted, hunted, hunting
hurdle, hurdled, hurdled, hurdling
hurl, hurled, hurled, hurling
hurrah, hurrahed, hurrahed, hurrahing
hurry, hurried, hurried, hurrying
hurt, hurted, hurted, hurting
hurtle, hurtled, hurtled, hurtling
husband, husbanded, husbanded, husbanding
hush, hushed, hushed, hushing
husk, husked, husked, husking
hustle, hustled, hustled, hustling
hybridise, hybridised, hybridised, hybridising
hybridize, hybridized, hybridized, hybridizing
hydrate, hydrated, hydrated, hydrating
hydrogen-bomb, hydrogen-bombed, hydrogen-bombed, hydrogen-bombing
hydrogenate, hydrogenated, hydrogenated, hydrogenating
hydrolise, hydrolised, hydrolised, hydrolising
hydrolize, hydrolized, hydrolized, hydrolizing
hydrolyse, hydrolysed, hydrolysed, hydrolysing
hydrolyze, hydrolyzed, hydrolyzed, hydrolyzing
hydroplane, hydroplaned, hydroplaned, hydroplaning
hygienise, hygienised, hygienised, hygienising
hygienize, hygienized, hygienized, hygienizing
hymn, hymned, hymned, hymning
hype, hyped, hyped, hyping
hyperbolise, hyperbolised, hyperbolised, hyperbolising
hyperbolize, hyperbolized, hyperbolized, hyperbolizing
hyperextend, hyperextended, hyperextended, hyperextending
hypertrophy, hypertrophied, hypertrophied, hypertrophying
hyperventilate, hyperventilated, hyperventilated, hyperventilating
hyphen, hyphened, hyphened, hyphening
hyphenate, hyphenated, hyphenated, hyphenating
hypnotise, hypnotised, hypnotised, hypnotising
hypnotize, hypnotized, hypnotized, hypnotizing
hypophysectomise, hypophysectomised, hypophysectomised, hypophysectomising
hypophysectomize, hypophysectomized, hypophysectomized, hypophysectomizing
hypostatise, hypostatised, hypostatised, hypostatising
hypostatize, hypostatized, hypostatized, hypostatizing
hypothecate, hypothecated, hypothecated, hypothecating
hypothesise, hypothesised, hypothesised, hypothesising
hypothesize, hypothesized, hypothesized, hypothesizing
ice, iced, iced, icing
idealise, idealised, idealised, idealising
idealize, idealized, idealized, idealizing
ideate, ideated, ideated, ideating
identify, identified, identified, identifying
idle, idled, idled, idling
idolise, idolised, idolised, idolising
idolize, idolized, idolized, idolizing
ignite, ignited, ignited, igniting
ignore, ignored, ignored, ignoring
ill-treat, ill-treated, ill-treated, ill-treating
ill-use, ill-used, ill-used, ill-using
illegalise, illegalised, illegalised, illegalising
illegalize, illegalized, illegalized, illegalizing
illume, illumed, illumed, illuming
illuminate, illuminated, illuminated, illuminating
illumine, illumined, illumined, illumining
illustrate, illustrated, illustrated, illustrating
image, imaged, imaged, imaging
imagine, imagined, imagined, imagining
imbed, imbeded, imbeded, imbeding
imbibe, imbibed, imbibed, imbibing
imbricate, imbricated, imbricated, imbricating
imbrue, imbrued, imbrued, imbruing
imbue, imbued, imbued, imbuing
imitate, imitated, imitated, imitating
immaterialise, immaterialised, immaterialised, immaterialising
immaterialize, immaterialized, immaterialized, immaterializing
immerse, immersed, immersed, immersing
immigrate, immigrated, immigrated, immigrating
immingle, immingled, immingled, immingling
immix, immixed, immixed, immixing
immobilise, immobilised, immobilised, immobilising
immobilize, immobilized, immobilized, immobilizing
immolate, immolated, immolated, immolating
immortalise, immortalised, immortalised, immortalising
immortalize, immortalized, immortalized, immortalizing
immunise, immunised, immunised, immunising
immunize, immunized, immunized, immunizing
immure, immured, immured, immuring
impact, impacted, impacted, impacting
impair, impaired, impaired, impairing
impale, impaled, impaled, impaling
impanel, impaneled, impaneled, impaneling
impart, imparted, imparted, imparting
impeach, impeached, impeached, impeaching
impede, impeded, impeded, impeding
impel, impeled, impeled, impeling
impend, impended, impended, impending
imperil, imperiled, imperiled, imperiling
impersonate, impersonated, impersonated, impersonating
impinge, impinged, impinged, impinging
implant, implanted, implanted, implanting
implement, implemented, implemented, implementing
implicate, implicated, implicated, implicating
implode, imploded, imploded, imploding
implore, implored, implored, imploring
imply, implied, implied, implying
import, imported, imported, importing
importune, importuned, importuned, importuning
impose, imposed, imposed, imposing
impound, impounded, impounded, impounding
impoverish, impoverished, impoverished, impoverishing
imprecate, imprecated, imprecated, imprecating
impregnate, impregnated, impregnated, impregnating
impress, impressed, impressed, impressing
imprint, imprinted, imprinted, imprinting
imprison, imprisoned, imprisoned, imprisoning
improve, improved, improved, improving
improvise, improvised, improvised, improvising
improvize, improvized, improvized, improvizing
impugn, impugned, impugned, impugning
impulse-buy, impulse-buied, impulse-buied, impulse-buying
impute, imputed, imputed, imputing
inactivate, inactivated, inactivated, inactivating
inaugurate, inaugurated, inaugurated, inaugurating
incandesce, incandesced, incandesced, incandescing
incapacitate, incapacitated, incapacitated, incapacitating
incarcerate, incarcerated, incarcerated, incarcerating
incarnadine, incarnadined, incarnadined, incarnadining
incarnate, incarnated, incarnated, incarnating
incase, incased, incased, incasing
incense, incensed, incensed, incensing
inch, inched, inched, inching
incinerate, incinerated, incinerated, incinerating
incise, incised, incised, incising
incite, incited, incited, inciting
incline, inclined, inclined, inclining
inclose, inclosed, inclosed, inclosing
include, included, included, including
incommode, incommoded, incommoded, incommoding
inconvenience, inconvenienced, inconvenienced, inconveniencing
incorporate, incorporated, incorporated, incorporating
increase, increased, increased, increasing
incriminate, incriminated, incriminated, incriminating
incrust, incrusted, incrusted, incrusting
incubate, incubated, incubated, incubating
inculcate, inculcated, inculcated, inculcating
inculpate, inculpated, inculpated, inculpating
incur, incured, incured, incuring
incurvate, incurvated, incurvated, incurvating
indemnify, indemnified, indemnified, indemnifying
indent, indented, indented, indenting
indenture, indentured, indentured, indenturing
index, indexed, indexed, indexing
indicate, indicated, indicated, indicating
indict, indicted, indicted, indicting
indispose, indisposed, indisposed, indisposing
indite, indited, indited, inditing
individualise, individualised, individualised, individualising
individualize, individualized, individualized, individualizing
individuate, individuated, individuated, individuating
indoctrinate, indoctrinated, indoctrinated, indoctrinating
indorse, indorsed, indorsed, indorsing
induce, induced, induced, inducing
induct, inducted, inducted, inducting
indue, indued, indued, induing
indulge, indulged, indulged, indulging
indurate, indurated, indurated, indurating
industrialise, industrialised, industrialised, industrialising
industrialize, industrialized, industrialized, industrializing
indwell, indwelled, indwelled, indwelling
inebriate, inebriated, inebriated, inebriating
infatuate, infatuated, infatuated, infatuating
infect, infected, infected, infecting
infer, infered, infered, infering
infest, infested, infested, infesting
infiltrate, infiltrated, infiltrated, infiltrating
infix, infixed, infixed, infixing
inflame, inflamed, inflamed, inflaming
inflate, inflated, inflated, inflating
inflect, inflected, inflected, inflecting
inflict, inflicted, inflicted, inflicting
influence, influenced, influenced, influencing
inform, informed, informed, informing
infract, infracted, infracted, infracting
infringe, infringed, infringed, infringing
infuriate, infuriated, infuriated, infuriating
infuscate, infuscated, infuscated, infuscating
infuse, infused, infused, infusing
ingeminate, ingeminated, ingeminated, ingeminating
ingest, ingested, ingested, ingesting
ingraft, ingrafted, ingrafted, ingrafting
ingrain, ingrained, ingrained, ingraining
ingratiate, ingratiated, ingratiated, ingratiating
ingurgitate, ingurgitated, ingurgitated, ingurgitating
inhabit, inhabited, inhabited, inhabiting
inhale, inhaled, inhaled, inhaling
inhere, inhered, inhered, inhering
inherit, inherited, inherited, inheriting
inhibit, inhibited, inhibited, inhibiting
inhume, inhumed, inhumed, inhuming
initial, initialed, initialed, initialing
initialise, initialised, initialised, initialising
initialize, initialized, initialized, initializing
initiate, initiated, initiated, initiating
inject, injected, injected, injecting
injure, injured, injured, injuring
ink, inked, inked, inking
inlay, inlaied, inlaied, inlaying
inmarry, inmarried, inmarried, inmarrying
innervate, innervated, innervated, innervating
innovate, innovated, innovated, innovating
inoculate, inoculated, inoculated, inoculating
inosculate, inosculated, inosculated, inosculating
input, inputed, inputed, inputing
inquire, inquired, inquired, inquiring
inscribe, inscribed, inscribed, inscribing
inseminate, inseminated, inseminated, inseminating
insert, inserted, inserted, inserting
inset, inseted, inseted, inseting
insinuate, insinuated, insinuated, insinuating
insist, insisted, insisted, insisting
insolate, insolated, insolated, insolating
inspan, inspaned, inspaned, inspaning
inspect, inspected, inspected, inspecting
inspire, inspired, inspired, inspiring
inspirit, inspirited, inspirited, inspiriting
inspissate, inspissated, inspissated, inspissating
instal, instaled, instaled, instaling
install, installed, installed, installing
instance, instanced, instanced, instancing
instantiate, instantiated, instantiated, instantiating
instigate, instigated, instigated, instigating
instil, instiled, instiled, instiling
instill, instilled, instilled, instilling
institute, instituted, instituted, instituting
institutionalise, institutionalised, institutionalised, institutionalising
institutionalize, institutionalized, institutionalized, institutionalizing
instruct, instructed, instructed, instructing
instrument, instrumented, instrumented, instrumenting
instrumentate, instrumentated, instrumentated, instrumentating
insufflate, insufflated, insufflated, insufflating
insulate, insulated, insulated, insulating
insult, insulted, insulted, insulting
insure, insured, insured, insuring
integrate, integrated, integrated, integrating
intend, intended, intended, intending
intensify, intensified, intensified, intensifying
inter, intered, intered, intering
interact, interacted, interacted, interacting
interbreed, interbreeded, interbreeded, interbreeding
intercalate, intercalated, intercalated, intercalating
intercede, interceded, interceded, interceding
intercept, intercepted, intercepted, intercepting
interchange, interchanged, interchanged, interchanging
intercommunicate, intercommunicated, intercommunicated, intercommunicating
interconnect, interconnected, interconnected, interconnecting
interdepend, interdepended, interdepended, interdepending
interdict, interdicted, interdicted, interdicting
interest, interested, interested, interesting
interfere, interfered, interfered, interfering
interiorise, interiorised, interiorised, interiorising
interiorize, interiorized, interiorized, interiorizing
interject, interjected, interjected, interjecting
interlace, interlaced, interlaced, interlacing
interlard, interlarded, interlarded, interlarding
interleave, interleaved, interleaved, interleaving
interlink, interlinked, interlinked, interlinking
interlock, interlocked, interlocked, interlocking
interlope, interloped, interloped, interloping
interlude, interluded, interluded, interluding
intermarry, intermarried, intermarried, intermarrying
intermediate, intermediated, intermediated, intermediating
intermingle, intermingled, intermingled, intermingling
intermit, intermited, intermited, intermiting
intermix, intermixed, intermixed, intermixing
intern, interned, interned, interning
internalise, internalised, internalised, internalising
internalize, internalized, internalized, internalizing
internationalise, internationalised, internationalised, internationalising
internationalize, internationalized, internationalized, internationalizing
interpellate, interpellated, interpellated, interpellating
interpenetrate, interpenetrated, interpenetrated, interpenetrating
interpolate, interpolated, interpolated, interpolating
interpose, interposed, interposed, interposing
interpret, interpreted, interpreted, interpreting
interrelate, interrelated, interrelated, interrelating
interrogate, interrogated, interrogated, interrogating
interrupt, interrupted, interrupted, interrupting
intersect, intersected, intersected, intersecting
intersperse, interspersed, interspersed, interspersing
interstratify, interstratified, interstratified, interstratifying
intertwine, intertwined, intertwined, intertwining
intervene, intervened, intervened, intervening
interview, interviewed, interviewed, interviewing
interweave, interweaved, interweaved, interweaving
intimate, intimated, intimated, intimating
intimidate, intimidated, intimidated, intimidating
intonate, intonated, intonated, intonating
intone, intoned, intoned, intoning
intoxicate, intoxicated, intoxicated, intoxicating
intransitivise, intransitivised, intransitivised, intransitivising
intransitivize, intransitivized, intransitivized, intransitivizing
intrench, intrenched, intrenched, intrenching
intrigue, intrigued, intrigued, intriguing
introduce, introduced, introduced, introducing
introject, introjected, introjected, introjecting
intromit, intromited, intromited, intromiting
introspect, introspected, introspected, introspecting
introvert, introverted, introverted, introverting
intrude, intruded, intruded, intruding
intrust, intrusted, intrusted, intrusting
intubate, intubated, intubated, intubating
intuit, intuited, intuited, intuiting
intumesce, intumesced, intumesced, intumescing
intussuscept, intussuscepted, intussuscepted, intussuscepting
inunct, inuncted, inuncted, inuncting
inundate, inundated, inundated, inundating
inure, inured, inured, inuring
invade, invaded, invaded, invading
invaginate, invaginated, invaginated, invaginating
invalid, invalided, invalided, invaliding
invalidate, invalidated, invalidated, invalidating
inveigh, inveighed, inveighed, inveighing
inveigle, inveigled, inveigled, inveigling
invent, invented, invented, inventing
inventory, inventoried, inventoried, inventorying
invert, inverted, inverted, inverting
invest, invested, invested, investing
investigate, investigated, investigated, investigating
invigilate, invigilated, invigilated, invigilating
invigorate, invigorated, invigorated, invigorating
invite, invited, invited, inviting
invoice, invoiced, invoiced, invoicing
invoke, invoked, invoked, invoking
involve, involved, involved, involving
inweave, inweaved, inweaved, inweaving
iodinate, iodinated, iodinated, iodinating
iodise, iodised, iodised, iodising
iodize, iodized, iodized, iodizing
ionate, ionated, ionated, ionating
ionise, ionised, ionised, ionising
ionize, ionized, ionized, ionizing
iridesce, iridesced, iridesced, iridescing
irk, irked, irked, irking
iron, ironed, ironed, ironing
irradiate, irradiated, irradiated, irradiating
irrigate, irrigated, irrigated, irrigating
irritate, irritated, irritated, irritating
irrupt, irrupted, irrupted, irrupting
islamise, islamised, islamised, islamising
islamize, islamized, islamized, islamizing
isolate, isolated, isolated, isolating
isomerise, isomerised, isomerised, isomerising
isomerize, isomerized, isomerized, isomerizing
issue, issued, issued, issuing
italicise, italicised, italicised, italicising
italicize, italicized, italicized, italicizing
itch, itched, itched, itching
itemise, itemised, itemised, itemising
itemize, itemized, itemized, itemizing
iterate, iterated, iterated, iterating
itinerate, itinerated, itinerated, itinerating
jab, jabed, jabed, jabing
jabber, jabbered, jabbered, jabbering
jack, jacked, jacked, jacking
jacket, jacketed, jacketed, jacketing
jackknife, jackknifed, jackknifed, jackknifing
jacklight, jacklighted, jacklighted, jacklighting
jackrabbit, jackrabbited, jackrabbited, jackrabbiting
jactitate, jactitated, jactitated, jactitating
jade, jaded, jaded, jading
jag, jaged, jaged, jaging
jail, jailed, jailed, jailing
jam, jamed, jamed, jaming
jampack, jampacked, jampacked, jampacking
jangle, jangled, jangled, jangling
japan, japaned, japaned, japaning
jar, jared, jared, jaring
jaundice, jaundiced, jaundiced, jaundicing
jaunt, jaunted, jaunted, jaunting
jaw, jawed, jawed, jawing
jawbone, jawboned, jawboned, jawboning
jaywalk, jaywalked, jaywalked, jaywalking
jazz, jazzed, jazzed, jazzing
jeer, jeered, jeered, jeering
jell, jelled, jelled, jelling
jellify, jellified, jellified, jellifying
jelly, jellied, jellied, jellying
jeopardise, jeopardised, jeopardised, jeopardising
jeopardize, jeopardized, jeopardized, jeopardizing
jerk, jerked, jerked, jerking
jest, jested, jested, jesting
jet, jeted, jeted, jeting
jettison, jettisoned, jettisoned, jettisoning
jewel, jeweled, jeweled, jeweling
jib, jibed, jibed, jibing
jibe, jibed, jibed, jibing
jig, jiged, jiged, jiging
jiggle, jiggled, jiggled, jiggling
jilt, jilted, jilted, jilting
jimmy, jimmied, jimmied, jimmying
jingle, jingled, jingled, jingling
jingle-jangle, jingle-jangled, jingle-jangled, jingle-jangling
jinx, jinxed, jinxed, jinxing
jitterbug, jitterbuged, jitterbuged, jitterbuging
jive, jived, jived, jiving
job, jobed, jobed, jobing
jockey, jockeied, jockeied, jockeying
jog, joged, joged, joging
joggle, joggled, joggled, joggling
join, joined, joined, joining
joint, jointed, jointed, jointing
joke, joked, joked, joking
jollify, jollified, jollified, jollifying
jolly, jollied, jollied, jollying
jolt, jolted, jolted, jolting
josh, joshed, joshed, joshing
jostle, jostled, jostled, jostling
jot, joted, joted, joting
jounce, jounced, jounced, jouncing
journey, journeied, journeied, journeying
joust, jousted, jousted, jousting
joy, joied, joied, joying
joyride, joyrided, joyrided, joyriding
jubilate, jubilated, jubilated, jubilating
judder, juddered, juddered, juddering
